,NAICS_Code, Action.Obligation , Obligation.2016 ,minyear,maxyear,2007 to 2012,1997 to 2002,,2007 NAICS U.S. Matched to 2012 NAICS U.S. (Full Concordance),,,,,,,,,,,,,,,,,,,,
1,233,"678,096,305","780,720,141",2007,2012,,,,(Note:  2012 NAICS codes in bold indicate pieces of the 2012 industry came from more than one 2007 NAICS industry; 2007 NAICS codes in italics indicate the 2007 industry split to two or more 2012 NAICS industries.),,,,,,,,,,,,,,,,,,,,
2,234,"71,956,446","81,605,853",2007,2012,,,3Sector,2007 NAICS Code,"2007 NAICS Title
(and specific piece of the 2007 industry that is contained in the 2012 industry)",2012 NAICS Code,2012 NAICS Title,,,,,482111,Line-Haul Railroads,482111,Line-Haul Railroads,,,,,,2002 NAICS U.S. Matched to 2007 NAICS U.S. (Full Concordance),,,
3,235,"63,397,980","72,261,628",2007,2012,,,111,111110,Soybean Farming,111110,Soybean Farming,,,,,482112,Short Line Railroads,482112,Short Line Railroads,,,,,,(Note:  2007 NAICS codes in bold indicate pieces of the 2007 industry came from more than one 2002 NAICS industry; 2002 NAICS codes in italics indicate the 2002 industry split to two or more 2007 NAICS industries.),,,
4,421,"47,930,688","55,046,924",2007,2012,,,111,111120,Oilseed (except Soybean) Farming,111120,Oilseed (except Soybean) Farming,,,,,491110,Postal Service,491110,Postal Service,,,,,,2002 NAICS Code,"2002 NAICS Title
(and specific piece of the 2002 industry that is contained in the 2007 industry) ",2007 NAICS Code,2007 NAICS Title
5,422,"57,492,362","65,775,195",2007,2012,,,111,111130,Dry Pea and Bean Farming,111130,Dry Pea and Bean Farming,,,,,525110,Pension Funds,525110,Pension Funds,,,,,111,111110,Soybean Farming,111110,Soybean Farming
6,482,"2,740,620","3,124,323",2007,2012,TRUE,,111,111140,Wheat Farming,111140,Wheat Farming,,,,,525120,Health and Welfare Funds,525120,Health and Welfare Funds,,,,,111,111120,Oilseed (except Soybean) Farming,111120,Oilseed (except Soybean) Farming
7,491,"67,787,932","72,380,283",2007,2012,TRUE,,111,111150,Corn Farming,111150,Corn Farming,,,,,525190,Other Insurance Funds,525190,Other Insurance Funds,,,,,111,111130,Dry Pea and Bean Farming,111130,Dry Pea and Bean Farming
8,513,"512,078,534","574,024,967",2007,2012,,,111,111160,Rice Farming,111160,Rice Farming,,,,,525910,Open-End Investment Funds,525910,Open-End Investment Funds,,,,,111,111140,Wheat Farming,111140,Wheat Farming
9,514,"348,610,145","399,865,897",2007,2012,,,111,111191,Oilseed and Grain Combination Farming,111191,Oilseed and Grain Combination Farming,,,,,525920,"Trusts, Estates, and Agency Accounts",525920,"Trusts, Estates, and Agency Accounts",,,,,111,111150,Corn Farming,111150,Corn Farming
10,516,"6,947,271","7,893,198",2007,2012,,,111,111199,All Other Grain Farming,111199,All Other Grain Farming,,,,,525990,Other Financial Vehicles,525990,Other Financial Vehicles,,,,,111,111160,Rice Farming,111160,Rice Farming
11,525,"2,624,177","2,745,951",2007,2012,TRUE,,111,111211,Potato Farming,111211,Potato Farming,,,,,814110,Private Households,814110,Private Households,,,,,111,111191,Oilseed and Grain Combination Farming,111191,Oilseed and Grain Combination Farming
12,814,"88,450","101,158",2007,2012,TRUE,,111,111219,Other Vegetable (except Potato) and Melon Farming,111219,Other Vegetable (except Potato) and Melon Farming,,,,,,,,,,,,,111,111199,All Other Grain Farming,111199,All Other Grain Farming
,,,,,,,,111,111310,Orange Groves,111310,Orange Groves,,,,,,,,,,,,,111,111211,Potato Farming,111211,Potato Farming
,,,,,,,,111,111320,Citrus (except Orange) Groves,111320,Citrus (except Orange) Groves,,,,,,,,,,,,,111,111219,Other Vegetable (except Potato) and Melon Farming - sweet potato and yam farming,111211,Potato Farming
,,,,,,,,111,111331,Apple Orchards,111331,Apple Orchards,,,,,,,,,,,,,111,111219,Other Vegetable (except Potato) and Melon Farming - except sweet potato and yam farming,111219,Other Vegetable (except Potato) and Melon Farming
,,,,,,,,111,111332,Grape Vineyards,111332,Grape Vineyards,,,,,,,,,,,,,111,111310,Orange Groves,111310,Orange Groves
,2362," 29,414,920,950.09 ",32072197446,2007,2012,,,111,111333,Strawberry Farming,111333,Strawberry Farming,,,,,,,,,,,,,111,111320,Citrus (except Orange) Groves,111320,Citrus (except Orange) Groves
,2371," 1,973,315,796.08 ",2156416652,2007,2012,,,111,111334,Berry (except Strawberry) Farming,111334,Berry (except Strawberry) Farming,,,,,,,,,,,,,111,111331,Apple Orchards,111331,Apple Orchards
,2372," 7,052,088.00 ",7973419.128,2007,2012,,,111,111335,Tree Nut Farming,111335,Tree Nut Farming,,,,,,,,,,,,,111,111332,Grape Vineyards,111332,Grape Vineyards
,2373," 2,569,732,912.89 ",2830894091,2007,2012,,,111,111336,Fruit and Tree Nut Combination Farming,111336,Fruit and Tree Nut Combination Farming,,,,,,,,,,,,,111,111333,Strawberry Farming,111333,Strawberry Farming
,2379," 7,871,562,679.42 ",8591318535,2007,2012,,,111,111339,Other Noncitrus Fruit Farming,111339,Other Noncitrus Fruit Farming,,,,,,,,,,,,,111,111334,Berry (except Strawberry) Farming,111334,Berry (except Strawberry) Farming
,2381," 833,726,142.73 ",911996351.7,2007,2012,,,111,111411,Mushroom Production,111411,Mushroom Production,,,,,,,,,,,,,111,111335,Tree Nut Farming,111335,Tree Nut Farming
,2382," 1,589,117,495.35 ",1718797205,2007,2012,,,111,111419,Other Food Crops Grown Under Cover,111419,Other Food Crops Grown Under Cover,,,,,,,,,,,,,111,111336,Fruit and Tree Nut Combination Farming,111336,Fruit and Tree Nut Combination Farming
,2383," 479,530,034.75 ",524097410.8,2007,2012,,,111,111421,Nursery and Tree Production,111421,Nursery and Tree Production,,,,,,,,,,,,,111,111339,Other Noncitrus Fruit Farming,111339,Other Noncitrus Fruit Farming
,2389," 2,035,947,635.05 ",2210261451,2007,2012,,,111,111422,Floriculture Production,111422,Floriculture Production,,,,,,,,,,,,,111,111411,Mushroom Production,111411,Mushroom Production
,,,,,,,,111,111910,Tobacco Farming,111910,Tobacco Farming,,,,,,,,,,,,,111,111419,Other Food Crops Grown Under Cover,111419,Other Food Crops Grown Under Cover
,,,,,,,,111,111920,Cotton Farming,111920,Cotton Farming,,,,,,,,,,,,,111,111421,Nursery and Tree Production,111421,Nursery and Tree Production
,,,,,,,,111,111930,Sugarcane Farming,111930,Sugarcane Farming,,,,,,,,,,,,,111,111422,Floriculture Production,111422,Floriculture Production
,,,,,,,,111,111940,Hay Farming,111940,Hay Farming,,,,,,,,,,,,,111,111910,Tobacco Farming,111910,Tobacco Farming
,,,,,,,,111,111991,Sugar Beet Farming,111991,Sugar Beet Farming,,,,,,,,,,,,,111,111920,Cotton Farming,111920,Cotton Farming
,,,,,,,,111,111992,Peanut Farming,111992,Peanut Farming,,,,,,,,,,,,,111,111930,Sugarcane Farming,111930,Sugarcane Farming
,,,,,,,,111,111998,All Other Miscellaneous Crop Farming,111998,All Other Miscellaneous Crop Farming,,,,,,,,,,,,,111,111940,Hay Farming,111940,Hay Farming
,,,,,,,,112,112111,Beef Cattle Ranching and Farming,112111,Beef Cattle Ranching and Farming,,,,,,,,,,,,,111,111991,Sugar Beet Farming,111991,Sugar Beet Farming
,,,,,,,,112,112112,Cattle Feedlots,112112,Cattle Feedlots,,,,,,,,,,,,,111,111992,Peanut Farming,111992,Peanut Farming
,,,,,,,,112,112120,Dairy Cattle and Milk Production,112120,Dairy Cattle and Milk Production,,,,,,,,,,,,,111,111998,"All Other Miscellaneous Crop Farming - except algae, seaweed, and other plant aquaculture",111998,All Other Miscellaneous Crop Farming
,,,,,,,,112,112130,Dual-Purpose Cattle Ranching and Farming,112130,Dual-Purpose Cattle Ranching and Farming,,,,,,,,,,,,,111,111998,"All Other Miscellaneous Crop Farming - algae, seaweed, and other plant aquaculture",112519,Other Aquaculture
,,,,,,,,112,112210,Hog and Pig Farming,112210,Hog and Pig Farming,,,,,,,,,,,,,112,112111,Beef Cattle Ranching and Farming,112111,Beef Cattle Ranching and Farming
,,,,,,,,112,112310,Chicken Egg Production,112310,Chicken Egg Production,,,,,,,,,,,,,112,112112,Cattle Feedlots,112112,Cattle Feedlots
,,,,,,,,112,112320,Broilers and Other Meat Type Chicken Production,112320,Broilers and Other Meat Type Chicken Production,,,,,,,,,,,,,112,112120,Dairy Cattle and Milk Production,112120,Dairy Cattle and Milk Production
,,,,,,,,112,112330,Turkey Production,112330,Turkey Production,,,,,,,,,,,,,112,112130,Dual-Purpose Cattle Ranching and Farming,112130,Dual-Purpose Cattle Ranching and Farming
,,,,,,,,112,112340,Poultry Hatcheries,112340,Poultry Hatcheries,,,,,,,,,,,,,112,112210,Hog and Pig Farming,112210,Hog and Pig Farming
,,,,,,,,112,112390,Other Poultry Production,112390,Other Poultry Production,,,,,,,,,,,,,112,112310,Chicken Egg Production,112310,Chicken Egg Production
,,,,,,,,112,112410,Sheep Farming,112410,Sheep Farming,,,,,,,,,,,,,112,112320,Broilers and Other Meat Type Chicken Production,112320,Broilers and Other Meat Type Chicken Production
,,,,,,,,112,112420,Goat Farming,112420,Goat Farming,,,,,,,,,,,,,112,112330,Turkey Production,112330,Turkey Production
,,,,,,,,112,112511,Finfish Farming and Fish Hatcheries,112511,Finfish Farming and Fish Hatcheries,,,,,,,,,,,,,112,112340,Poultry Hatcheries,112340,Poultry Hatcheries
,,,,,,,,112,112512,Shellfish Farming,112512,Shellfish Farming,,,,,,,,,,,,,112,112390,Other Poultry Production,112390,Other Poultry Production
,,,,,,,,112,112519,Other Aquaculture,112519,Other Aquaculture,,,,,,,,,,,,,112,112410,Sheep Farming,112410,Sheep Farming
,,,,,,,,112,112910,Apiculture,112910,Apiculture,,,,,,,,,,,,,112,112420,Goat Farming,112420,Goat Farming
,,,,,,,,112,112920,Horses and Other Equine Production,112920,Horses and Other Equine Production,,,,,,,,,,,,,112,112511,Finfish Farming and Fish Hatcheries,112511,Finfish Farming and Fish Hatcheries
,,,,,,,,112,112930,Fur-Bearing Animal and Rabbit Production,112930,Fur-Bearing Animal and Rabbit Production,,,,,,,,,,,,,112,112512,Shellfish Farming,112512,Shellfish Farming
,,,,,,,,112,112990,All Other Animal Production,112990,All Other Animal Production,,,,,,,,,,,,,112,112519,Other Animal Aquaculture - animal aquaculture except finfish and shellfish,112519,Other Aquaculture
,,,,,,,,113,113110,Timber Tract Operations,113110,Timber Tract Operations,,,,,,,,,,,,,112,112910,Apiculture,112910,Apiculture
,,,,,,,,113,113210,Forest Nurseries and Gathering of Forest Products,113210,Forest Nurseries and Gathering of Forest Products,,,,,,,,,,,,,112,112920,Horses and Other Equine Production,112920,Horses and Other Equine Production
,,,,,,,,113,113310,Logging,113310,Logging,,,,,,,,,,,,,112,112930,Fur-Bearing Animal and Rabbit Production,112930,Fur-Bearing Animal and Rabbit Production
,,,,,,,,114,114111,Finfish Fishing,114111,Finfish Fishing,,,,,,,,,,,,,112,112990,All Other Animal Production,112990,All Other Animal Production
,,,,,,,,114,114112,Shellfish Fishing,114112,Shellfish Fishing,,,,,,,,,,,,,113,113110,Timber Tract Operations,113110,Timber Tract Operations
,,,,,,,,114,114119,Other Marine Fishing,114119,Other Marine Fishing,,,,,,,,,,,,,113,113210,Forest Nurseries and Gathering of Forest Products,113210,Forest Nurseries and Gathering of Forest Products
,,,,,,,,114,114210,Hunting and Trapping,114210,Hunting and Trapping,,,,,,,,,,,,,113,113310,Logging,113310,Logging
,,,,,,,,115,115111,Cotton Ginning,115111,Cotton Ginning,,,,,,,,,,,,,114,114111,Finfish Fishing,114111,Finfish Fishing
,,,,,,,,115,115112,"Soil Preparation, Planting, and Cultivating",115112,"Soil Preparation, Planting, and Cultivating",,,,,,,,,,,,,114,114112,Shellfish Fishing,114112,Shellfish Fishing
,,,,,,,,115,115113,"Crop Harvesting, Primarily by Machine",115113,"Crop Harvesting, Primarily by Machine",,,,,,,,,,,,,114,114119,Other Marine Fishing,114119,Other Marine Fishing
,,,,,,,,115,115114,Postharvest Crop Activities (except Cotton Ginning),115114,Postharvest Crop Activities (except Cotton Ginning),,,,,,,,,,,,,114,114210,Hunting and Trapping,114210,Hunting and Trapping
,,,,,,,,115,115115,Farm Labor Contractors and Crew Leaders,115115,Farm Labor Contractors and Crew Leaders,,,,,,,,,,,,,115,115111,Cotton Ginning,115111,Cotton Ginning
,,,,,,,,115,115116,Farm Management Services,115116,Farm Management Services,,,,,,,,,,,,,115,115112,"Soil Preparation, Planting, and Cultivating",115112,"Soil Preparation, Planting, and Cultivating"
,,,,,,,,115,115210,Support Activities for Animal Production,115210,Support Activities for Animal Production,,,,,,,,,,,,,115,115113,"Crop Harvesting, Primarily by Machine",115113,"Crop Harvesting, Primarily by Machine"
,,,,,,,,115,115310,Support Activities for Forestry,115310,Support Activities for Forestry,,,,,,,,,,,,,115,115114,Postharvest Crop Activities (except Cotton Ginning),115114,Postharvest Crop Activities (except Cotton Ginning)
,,,,,,,,211,211111,Crude Petroleum and Natural Gas Extraction,211111,Crude Petroleum and Natural Gas Extraction,,,,,,,,,,,,,115,115115,Farm Labor Contractors and Crew Leaders,115115,Farm Labor Contractors and Crew Leaders
,,,,,,,,211,211112,Natural Gas Liquid Extraction,211112,Natural Gas Liquid Extraction,,,,,,,,,,,,,115,115116,Farm Management Services,115116,Farm Management Services
,,,,,,,,212,212111,Bituminous Coal and Lignite Surface Mining,212111,Bituminous Coal and Lignite Surface Mining,,,,,,,,,,,,,115,115210,Support Activities for Animal Production,115210,Support Activities for Animal Production
,,,,,,,,212,212112,Bituminous Coal Underground Mining,212112,Bituminous Coal Underground Mining,,,,,,,,,,,,,115,115310,Support Activities for Forestry,115310,Support Activities for Forestry
,,,,,,,,212,212113,Anthracite Mining,212113,Anthracite Mining,,,,,,,,,,,,,211,211111,Crude Petroleum and Natural Gas Extraction,211111,Crude Petroleum and Natural Gas Extraction
,,,,,,,,212,212210,Iron Ore Mining,212210,Iron Ore Mining,,,,,,,,,,,,,211,211112,Natural Gas Liquid Extraction,211112,Natural Gas Liquid Extraction
,,,,,,,,212,212221,Gold Ore Mining,212221,Gold Ore Mining,,,,,,,,,,,,,212,212111,Bituminous Coal and Lignite Surface Mining,212111,Bituminous Coal and Lignite Surface Mining
,,,,,,,,212,212222,Silver Ore Mining,212222,Silver Ore Mining,,,,,,,,,,,,,212,212112,Bituminous Coal Underground Mining,212112,Bituminous Coal Underground Mining
,,,,,,,,212,212231,Lead Ore and Zinc Ore Mining,212231,Lead Ore and Zinc Ore Mining,,,,,,,,,,,,,212,212113,Anthracite Mining,212113,Anthracite Mining
,,,,,,,,212,212234,Copper Ore and Nickel Ore Mining,212234,Copper Ore and Nickel Ore Mining,,,,,,,,,,,,,212,212210,Iron Ore Mining,212210,Iron Ore Mining
,,,,,,,,212,212291,Uranium-Radium-Vanadium Ore Mining,212291,Uranium-Radium-Vanadium Ore Mining,,,,,,,,,,,,,212,212221,Gold Ore Mining,212221,Gold Ore Mining
,,,,,,,,212,212299,All Other Metal Ore Mining,212299,All Other Metal Ore Mining,,,,,,,,,,,,,212,212222,Silver Ore Mining,212222,Silver Ore Mining
,,,,,,,,212,212311,Dimension Stone Mining and Quarrying,212311,Dimension Stone Mining and Quarrying,,,,,,,,,,,,,212,212231,Lead Ore and Zinc Ore Mining,212231,Lead Ore and Zinc Ore Mining
,,,,,,,,212,212312,Crushed and Broken Limestone Mining and Quarrying,212312,Crushed and Broken Limestone Mining and Quarrying,,,,,,,,,,,,,212,212234,Copper Ore and Nickel Ore Mining,212234,Copper Ore and Nickel Ore Mining
,,,,,,,,212,212313,Crushed and Broken Granite Mining and Quarrying,212313,Crushed and Broken Granite Mining and Quarrying,,,,,,,,,,,,,212,212291,Uranium-Radium-Vanadium Ore Mining,212291,Uranium-Radium-Vanadium Ore Mining
,,,,,,,,212,212319,Other Crushed and Broken Stone Mining and Quarrying,212319,Other Crushed and Broken Stone Mining and Quarrying,,,,,,,,,,,,,212,212299,All Other Metal Ore Mining,212299,All Other Metal Ore Mining
,,,,,,,,212,212321,Construction Sand and Gravel Mining,212321,Construction Sand and Gravel Mining,,,,,,,,,,,,,212,212311,Dimension Stone Mining and Quarrying,212311,Dimension Stone Mining and Quarrying
,,,,,,,,212,212322,Industrial Sand Mining,212322,Industrial Sand Mining,,,,,,,,,,,,,212,212312,Crushed and Broken Limestone Mining and Quarrying,212312,Crushed and Broken Limestone Mining and Quarrying
,,,,,,,,212,212324,Kaolin and Ball Clay Mining,212324,Kaolin and Ball Clay Mining,,,,,,,,,,,,,212,212313,Crushed and Broken Granite Mining and Quarrying,212313,Crushed and Broken Granite Mining and Quarrying
,,,,,,,,212,212325,Clay and Ceramic and Refractory Minerals Mining,212325,Clay and Ceramic and Refractory Minerals Mining,,,,,,,,,,,,,212,212319,Other Crushed and Broken Stone Mining and Quarrying,212319,Other Crushed and Broken Stone Mining and Quarrying
,,,,,,,,212,212391,"Potash, Soda, and Borate Mineral Mining",212391,"Potash, Soda, and Borate Mineral Mining",,,,,,,,,,,,,212,212321,Construction Sand and Gravel Mining,212321,Construction Sand and Gravel Mining
,,,,,,,,212,212392,Phosphate Rock Mining,212392,Phosphate Rock Mining,,,,,,,,,,,,,212,212322,Industrial Sand Mining,212322,Industrial Sand Mining
,,,,,,,,212,212393,Other Chemical and Fertilizer Mineral Mining,212393,Other Chemical and Fertilizer Mineral Mining,,,,,,,,,,,,,212,212324,Kaolin and Ball Clay Mining,212324,Kaolin and Ball Clay Mining
,,,,,,,,212,212399,All Other Nonmetallic Mineral Mining,212399,All Other Nonmetallic Mineral Mining,,,,,,,,,,,,,212,212325,Clay and Ceramic and Refractory Minerals Mining,212325,Clay and Ceramic and Refractory Minerals Mining
,,,,,,,,213,213111,Drilling Oil and Gas Wells,213111,Drilling Oil and Gas Wells,,,,,,,,,,,,,212,212391,"Potash, Soda, and Borate Mineral Mining",212391,"Potash, Soda, and Borate Mineral Mining"
,,,,,,,,213,213112,Support Activities for Oil and Gas Operations,213112,Support Activities for Oil and Gas Operations,,,,,,,,,,,,,212,212392,Phosphate Rock Mining,212392,Phosphate Rock Mining
,,,,,,,,213,213113,Support Activities for Coal Mining,213113,Support Activities for Coal Mining,,,,,,,,,,,,,212,212393,Other Chemical and Fertilizer Mineral Mining,212393,Other Chemical and Fertilizer Mineral Mining
,,,,,,,,213,213114,Support Activities for Metal Mining,213114,Support Activities for Metal Mining,,,,,,,,,,,,,212,212399,All Other Nonmetallic Mineral Mining,212399,All Other Nonmetallic Mineral Mining
,,,,,,,,213,213115,Support Activities for Nonmetallic Minerals (except Fuels) Mining,213115,Support Activities for Nonmetallic Minerals (except Fuels) Mining,,,,,,,,,,,,,213,213111,Drilling Oil and Gas Wells,213111,Drilling Oil and Gas Wells
,,,,,,,,221,221111,Hydroelectric Power Generation,221111,Hydroelectric Power Generation,,,,,,,,,,,,,213,213112,Support Activities for Oil and Gas Operations,213112,Support Activities for Oil and Gas Operations
,,,,,,,,221,221112,Fossil Fuel Electric Power Generation,221112,Fossil Fuel Electric Power Generation,,,,,,,,,,,,,213,213113,Support Activities for Coal Mining,213113,Support Activities for Coal Mining
,,,,,,,,221,221113,Nuclear Electric Power Generation,221113,Nuclear Electric Power Generation,,,,,,,,,,,,,213,213114,Support Activities for Metal Mining,213114,Support Activities for Metal Mining
,,,,,,,,221,221119,Other Electric Power Generation - solar electric power generation,221114,Solar Electric Power Generation,,,,,,,,,,,,,213,213115,Support Activities for Nonmetallic Minerals (except Fuels),213115,Support Activities for Nonmetallic Minerals (except Fuels)
,,,,,,,,221,221119,Other Electric Power Generation - wind electric power generation,221115,Wind Electric Power Generation,,,,,,,,,,,,,221,221111,Hydroelectric Power Generation,221111,Hydroelectric Power Generation
,,,,,,,,221,221119,Other Electric Power Generation - geothermal electric power generation,221116,Geothermal Electric Power Generation,,,,,,,,,,,,,221,221112,Fossil Fuel Electric Power Generation,221112,Fossil Fuel Electric Power Generation
,,,,,,,,221,221119,Other Electric Power Generation - biomass electric power generation,221117,Biomass Electric Power Generation,,,,,,,,,,,,,221,221113,Nuclear Electric Power Generation,221113,Nuclear Electric Power Generation
,,,,,,,,221,221119,"Other Electric Power Generation - except solar, wind, geothermal, and biomass electric power generation",221118,Other Electric Power Generation,,,,,,,,,,,,,221,221119,Other Electric Power Generation,221119,Other Electric Power Generation
,,,,,,,,221,221121,Electric Bulk Power Transmission and Control,221121,Electric Bulk Power Transmission and Control,,,,,,,,,,,,,221,221121,Electric Bulk Power Transmission and Control,221121,Electric Bulk Power Transmission and Control
,,,,,,,,221,221122,Electric Power Distribution,221122,Electric Power Distribution,,,,,,,,,,,,,221,221122,Electric Power Distribution,221122,Electric Power Distribution
,,,,,,,,221,221210,Natural Gas Distribution,221210,Natural Gas Distribution,,,,,,,,,,,,,221,221210,Natural Gas Distribution,221210,Natural Gas Distribution
,,,,,,,,221,221310,Water Supply and Irrigation Systems,221310,Water Supply and Irrigation Systems,,,,,,,,,,,,,221,221310,Water Supply and Irrigation Systems,221310,Water Supply and Irrigation Systems
,,,,,,,,221,221320,Sewage Treatment Facilities,221320,Sewage Treatment Facilities,,,,,,,,,,,,,221,221320,Sewage Treatment Facilities,221320,Sewage Treatment Facilities
,,,,,,,,221,221330,Steam and Air-Conditioning Supply,221330,Steam and Air-Conditioning Supply,,,,,,,,,,,,,221,221330,Steam and Air-Conditioning Supply,221330,Steam and Air-Conditioning Supply
,,,,,,,,236,236115,New Single-Family Housing Construction (except Operative Builders),236115,New Single-Family Housing Construction (except For-Sale Builders),,,,,,,,,,,,,236,236115,New Single-Family Housing Construction (except Operative Builders),236115,New Single-Family Housing Construction (except Operative Builders)
,,,,,,,,236,236116,New Multifamily Housing Construction (except Operative Builders),236116,New Multifamily Housing Construction (except For-Sale Builders),,,,,,,,,,,,,236,236116,New Multifamily Housing Construction (except Operative Builders),236116,New Multifamily Housing Construction (except Operative Builders)
,,,,,,,,236,236117,New Housing Operative Builders,236117,New Housing For-Sale Builders,,,,,,,,,,,,,236,236117,New Housing Operative Builders,236117,New Housing Operative Builders
,,,,,,,,236,236118,Residential Remodelers,236118,Residential Remodelers,,,,,,,,,,,,,236,236118,Residential Remodelers,236118,Residential Remodelers
,,,,,,,,236,236210,Industrial Building Construction,236210,Industrial Building Construction,,,,,,,,,,,,,236,236210,Industrial Building Construction,236210,Industrial Building Construction
,,,,,,,,236,236220,Commercial and Institutional Building Construction,236220,Commercial and Institutional Building Construction,,,,,,,,,,,,,236,236220,Commercial and Institutional Building Construction,236220,Commercial and Institutional Building Construction
,,,,,,,,237,237110,Water and Sewer Line and Related Structures Construction,237110,Water and Sewer Line and Related Structures Construction,,,,,,,,,,,,,237,237110,Water and Sewer Line and Related Structures Construction,237110,Water and Sewer Line and Related Structures Construction
,,,,,,,,237,237120,Oil and Gas Pipeline and Related Structures Construction,237120,Oil and Gas Pipeline and Related Structures Construction,,,,,,,,,,,,,237,237120,Oil and Gas Pipeline and Related Structures Construction,237120,Oil and Gas Pipeline and Related Structures Construction
,,,,,,,,237,237130,Power and Communication Line and Related Structures Construction,237130,Power and Communication Line and Related Structures Construction,,,,,,,,,,,,,237,237130,Power and Communication Line and Related Structures Construction,237130,Power and Communication Line and Related Structures Construction
,,,,,,,,237,237210,Land Subdivision,237210,Land Subdivision,,,,,,,,,,,,,237,237210,Land Subdivision,237210,Land Subdivision
,,,,,,,,237,237310,"Highway, Street, and Bridge Construction",237310,"Highway, Street, and Bridge Construction",,,,,,,,,,,,,237,237310,"Highway, Street, and Bridge Construction",237310,"Highway, Street, and Bridge Construction"
,,,,,,,,237,237990,Other Heavy and Civil Engineering Construction,237990,Other Heavy and Civil Engineering Construction,,,,,,,,,,,,,237,237990,Other Heavy and Civil Engineering Construction,237990,Other Heavy and Civil Engineering Construction
,,,,,,,,238,238110,Poured Concrete Foundation and Structure Contractors,238110,Poured Concrete Foundation and Structure Contractors,,,,,,,,,,,,,238,238110,Poured Concrete Foundation and Structure Contractors,238110,Poured Concrete Foundation and Structure Contractors
,,,,,,,,238,238120,Structural Steel and Precast Concrete Contractors,238120,Structural Steel and Precast Concrete Contractors,,,,,,,,,,,,,238,238120,Structural Steel and Precast Concrete Contractors,238120,Structural Steel and Precast Concrete Contractors
,,,,,,,,238,238130,Framing Contractors,238130,Framing Contractors,,,,,,,,,,,,,238,238130,Framing Contractors,238130,Framing Contractors
,,,,,,,,238,238140,Masonry Contractors,238140,Masonry Contractors,,,,,,,,,,,,,238,238140,Masonry Contractors,238140,Masonry Contractors
,,,,,,,,238,238150,Glass and Glazing Contractors,238150,Glass and Glazing Contractors,,,,,,,,,,,,,238,238150,Glass and Glazing Contractors,238150,Glass and Glazing Contractors
,,,,,,,,238,238160,Roofing Contractors,238160,Roofing Contractors,,,,,,,,,,,,,238,238160,Roofing Contractors,238160,Roofing Contractors
,,,,,,,,238,238170,Siding Contractors,238170,Siding Contractors,,,,,,,,,,,,,238,238170,Siding Contractors,238170,Siding Contractors
,,,,,,,,238,238190,"Other Foundation, Structure, and Building Exterior Contractors - except building fireproofing contractors",238190,"Other Foundation, Structure, and Building Exterior Contractors",,,,,,,,,,,,,238,238190,"Other Foundation, Structure, and Building Exterior Contractors",238190,"Other Foundation, Structure, and Building Exterior Contractors"
,,,,,,,,238,238190,"Other Foundation, Structure, and Building Exterior Contractors - building fireproofing contractors",238310,Drywall and Insulation Contractors,,,,,,,,,,,,,238,238210,Electrical Contractors,238210,Electrical Contractors and Other Wiring Installation Contractors
