,,,,,,,,511,511140,Directory and Mailing List Publishers,511140,Directory and Mailing List Publishers,,,,,,,,,,,,,492,492210,Local Messengers and Local Delivery,492210,Local Messengers and Local Delivery
,,,,,,,,511,511191,Greeting Card Publishers,511191,Greeting Card Publishers,,,,,,,,,,,,,493,493110,General Warehousing and Storage,493110,General Warehousing and Storage
,,,,,,,,511,511199,All Other Publishers,511199,All Other Publishers,,,,,,,,,,,,,493,493120,Refrigerated Warehousing and Storage,493120,Refrigerated Warehousing and Storage
,,,,,,,,511,511210,Software Publishers,511210,Software Publishers,,,,,,,,,,,,,493,493130,Farm Product Warehousing and Storage,493130,Farm Product Warehousing and Storage
,,,,,,,,512,512110,Motion Picture and Video Production,512110,Motion Picture and Video Production,,,,,,,,,,,,,493,493190,Other Warehousing and Storage,493190,Other Warehousing and Storage
,,,,,,,,512,512120,Motion Picture and Video Distribution,512120,Motion Picture and Video Distribution,,,,,,,,,,,,,511,511110,Newspaper Publishers,511110,Newspaper Publishers
,,,,,,,,512,512131,Motion Picture Theaters (except Drive-Ins),512131,Motion Picture Theaters (except Drive-Ins),,,,,,,,,,,,,511,511120,Periodical Publishers,511120,Periodical Publishers
,,,,,,,,512,512132,Drive-In Motion Picture Theaters,512132,Drive-In Motion Picture Theaters,,,,,,,,,,,,,511,511130,Book Publishers,511130,Book Publishers
,,,,,,,,512,512191,Teleproduction and Other Postproduction Services,512191,Teleproduction and Other Postproduction Services,,,,,,,,,,,,,511,511140,Directory and Mailing List Publishers,511140,Directory and Mailing List Publishers
,,,,,,,,512,512199,Other Motion Picture and Video Industries,512199,Other Motion Picture and Video Industries,,,,,,,,,,,,,511,511191,Greeting Card Publishers,511191,Greeting Card Publishers
,,,,,,,,512,512210,Record Production,512210,Record Production,,,,,,,,,,,,,511,511199,All Other Publishers,511199,All Other Publishers
,,,,,,,,512,512220,Integrated Record Production/Distribution,512220,Integrated Record Production/Distribution,,,,,,,,,,,,,511,511210,Software Publishers,511210,Software Publishers
,,,,,,,,512,512230,Music Publishers,512230,Music Publishers,,,,,,,,,,,,,512,512110,Motion Picture and Video Production,512110,Motion Picture and Video Production
,,,,,,,,512,512240,Sound Recording Studios,512240,Sound Recording Studios,,,,,,,,,,,,,512,512120,Motion Picture and Video Distribution,512120,Motion Picture and Video Distribution
,,,,,,,,512,512290,Other Sound Recording Industries,512290,Other Sound Recording Industries,,,,,,,,,,,,,512,512131,Motion Picture Theaters (except Drive-Ins),512131,Motion Picture Theaters (except Drive-Ins)
,,,,,,,,515,515111,Radio Networks,515111,Radio Networks,,,,,,,,,,,,,512,512132,Drive-In Motion Picture Theaters,512132,Drive-In Motion Picture Theaters
,,,,,,,,515,515112,Radio Stations,515112,Radio Stations,,,,,,,,,,,,,512,512191,Teleproduction and Other Postproduction Services,512191,Teleproduction and Other Postproduction Services
,,,,,,,,515,515120,Television Broadcasting,515120,Television Broadcasting,,,,,,,,,,,,,512,512199,Other Motion Picture and Video Industries,512199,Other Motion Picture and Video Industries
,,,,,,,,515,515210,Cable and Other Subscription Programming,515210,Cable and Other Subscription Programming,,,,,,,,,,,,,512,512210,Record Production,512210,Record Production
,,,,,,,,517,517110,Wired Telecommunications Carriers,517110,Wired Telecommunications Carriers,,,,,,,,,,,,,512,512220,Integrated Record Production/Distribution,512220,Integrated Record Production/Distribution
,,,,,,,,517,517210,Wireless Telecommunications Carriers (except Satellite),517210,Wireless Telecommunications Carriers (except Satellite),,,,,,,,,,,,,512,512230,Music Publishers,512230,Music Publishers
,,,,,,,,517,517410,Satellite Telecommunications,517410,Satellite Telecommunications,,,,,,,,,,,,,512,512240,Sound Recording Studios,512240,Sound Recording Studios
,,,,,,,,517,517911,Telecommunications Resellers,517911,Telecommunications Resellers,,,,,,,,,,,,,512,512290,Other Sound Recording Industries,512290,Other Sound Recording Industries
,,,,,,,,517,517919,All Other Telecommunications,517919,All Other Telecommunications,,,,,,,,,,,,,515,515111,Radio Networks,515111,Radio Networks
,,,,,,,,518,518210,"Data Processing, Hosting, and Related Services",518210,"Data Processing, Hosting, and Related Services",,,,,,,,,,,,,515,515112,Radio Stations,515112,Radio Stations
,,,,,,,,519,519110,News Syndicates,519110,News Syndicates,,,,,,,,,,,,,515,515120,Television Broadcasting,515120,Television Broadcasting
,,,,,,,,519,519120,Libraries and Archives,519120,Libraries and Archives,,,,,,,,,,,,,515,515210,Cable and Other Subscription Programming,515210,Cable and Other Subscription Programming
,,,,,,,,519,519130,Internet Publishing and Broadcasting and Web Search Portals,519130,Internet Publishing and Broadcasting and Web Search Portals,,,,,,,,,,,,,516,516110,Internet Publishing and Broadcasting,519130,Internet Publishing and Broadcasting and Web Search Portals
,,,,,,,,519,519190,All Other Information Services,519190,All Other Information Services,,,,,,,,,,,,,517,517110,Wired Telecommunications Carriers,517110,Wired Telecommunications Carriers
,,,,,,,,521,521110,Monetary Authorities-Central Bank,521110,Monetary Authorities-Central Bank,,,,,,,,,,,,,517,517211,Paging,517210,Wireless Telecommunications Carriers (except Satellite)
,,,,,,,,522,522110,Commercial Banking,522110,Commercial Banking,,,,,,,,,,,,,517,517212,Cellular and Other Wireless Telecommunications,517210,Wireless Telecommunications Carriers (except Satellite)
,,,,,,,,522,522120,Savings Institutions,522120,Savings Institutions,,,,,,,,,,,,,517,517310,Telecommunications Resellers,517911,Telecommunications Resellers
,,,,,,,,522,522130,Credit Unions,522130,Credit Unions,,,,,,,,,,,,,517,517410,Satellite Telecommunications,517410,Satellite Telecommunications
,,,,,,,,522,522190,Other Depository Credit Intermediation,522190,Other Depository Credit Intermediation,,,,,,,,,,,,,517,517510,Cable and Other Program Distribution,517110,Wired Telecommunications Carriers
,,,,,,,,522,522210,Credit Card Issuing,522210,Credit Card Issuing,,,,,,,,,,,,,517,517910,Other Telecommunications,517919,All Other Telecommunications
,,,,,,,,522,522220,Sales Financing,522220,Sales Financing,,,,,,,,,,,,,518,518111,"Internet Service Providers - broadband Internet service providers (e.g., cable, DSL)",517110,Wired Telecommunications Carriers
,,,,,,,,522,522291,Consumer Lending,522291,Consumer Lending,,,,,,,,,,,,,518,518111,Internet Service Providers - Internet services providers providing services via client-supplied telecommunications connection,517919,All Other Telecommunications
,,,,,,,,522,522292,Real Estate Credit,522292,Real Estate Credit,,,,,,,,,,,,,518,518112,Web Search Portals,519130,Internet Publishing and Broadcasting and Web Search Portals
,,,,,,,,522,522293,International Trade Financing,522293,International Trade Financing,,,,,,,,,,,,,518,518210,"Data Processing, Hosting, and Related Services",518210,"Data Processing, Hosting, and Related Services"
,,,,,,,,522,522294,Secondary Market Financing,522294,Secondary Market Financing,,,,,,,,,,,,,519,519110,News Syndicates,519110,News Syndicates
,,,,,,,,522,522298,All Other Nondepository Credit Intermediation,522298,All Other Nondepository Credit Intermediation,,,,,,,,,,,,,519,519120,Libraries and Archives,519120,Libraries and Archives
,,,,,,,,522,522310,Mortgage and Nonmortgage Loan Brokers,522310,Mortgage and Nonmortgage Loan Brokers,,,,,,,,,,,,,519,519190,All Other Information Services,519190,All Other Information Services
,,,,,,,,522,522320,"Financial Transactions Processing, Reserve, and Clearinghouse Activities",522320,"Financial Transactions Processing, Reserve, and Clearinghouse Activities",,,,,,,,,,,,,521,521110,Monetary Authorities - Central Bank,521110,Monetary Authorities - Central Bank
,,,,,,,,522,522390,Other Activities Related to Credit Intermediation,522390,Other Activities Related to Credit Intermediation,,,,,,,,,,,,,522,522110,Commercial Banking,522110,Commercial Banking
,,,,,,,,523,523110,Investment Banking and Securities Dealing,523110,Investment Banking and Securities Dealing,,,,,,,,,,,,,522,522120,Savings Institutions,522120,Savings Institutions
,,,,,,,,523,523120,Securities Brokerage,523120,Securities Brokerage,,,,,,,,,,,,,522,522130,Credit Unions,522130,Credit Unions
,,,,,,,,523,523130,Commodity Contracts Dealing,523130,Commodity Contracts Dealing,,,,,,,,,,,,,522,522190,Other Depository Credit Intermediation,522190,Other Depository Credit Intermediation
,,,,,,,,523,523140,Commodity Contracts Brokerage,523140,Commodity Contracts Brokerage,,,,,,,,,,,,,522,522210,Credit Card Issuing,522210,Credit Card Issuing
,,,,,,,,523,523210,Securities and Commodity Exchanges,523210,Securities and Commodity Exchanges,,,,,,,,,,,,,522,522220,Sales Financing,522220,Sales Financing
,,,,,,,,523,523910,Miscellaneous Intermediation,523910,Miscellaneous Intermediation,,,,,,,,,,,,,522,522291,Consumer Lending,522291,Consumer Lending
,,,,,,,,523,523920,Portfolio Management,523920,Portfolio Management,,,,,,,,,,,,,522,522292,Real Estate Credit,522292,Real Estate Credit
,,,,,,,,523,523930,Investment Advice,523930,Investment Advice,,,,,,,,,,,,,522,522293,International Trade Financing,522293,International Trade Financing
,,,,,,,,523,523991,"Trust, Fiduciary, and Custody Activities",523991,"Trust, Fiduciary, and Custody Activities",,,,,,,,,,,,,522,522294,Secondary Market Financing,522294,Secondary Market Financing
,,,,,,,,523,523999,Miscellaneous Financial Investment Activities,523999,Miscellaneous Financial Investment Activities,,,,,,,,,,,,,522,522298,All Other Nondepository Credit Intermediation,522298,All Other Nondepository Credit Intermediation
,,,,,,,,524,524113,Direct Life Insurance Carriers,524113,Direct Life Insurance Carriers,,,,,,,,,,,,,522,522310,Mortgage and Nonmortgage Loan Brokers,522310,Mortgage and Nonmortgage Loan Brokers
,,,,,,,,524,524114,Direct Health and Medical Insurance Carriers,524114,Direct Health and Medical Insurance Carriers,,,,,,,,,,,,,522,522320,"Financial Transactions Processing, Reserve, and Clearinghouse Activities",522320,"Financial Transactions Processing, Reserve, and Clearinghouse Activities"
,,,,,,,,524,524126,Direct Property and Casualty Insurance Carriers,524126,Direct Property and Casualty Insurance Carriers,,,,,,,,,,,,,522,522390,Other Activities Related to Credit Intermediation,522390,Other Activities Related to Credit Intermediation
,,,,,,,,524,524127,Direct Title Insurance Carriers,524127,Direct Title Insurance Carriers,,,,,,,,,,,,,523,523110,Investment Banking and Securities Dealing,523110,Investment Banking and Securities Dealing
,,,,,,,,524,524128,"Other Direct Insurance (except Life, Health, and Medical) Carriers",524128,"Other Direct Insurance (except Life, Health, and Medical) Carriers",,,,,,,,,,,,,523,523120,Securities Brokerage,523120,Securities Brokerage
,,,,,,,,524,524130,Reinsurance Carriers,524130,Reinsurance Carriers,,,,,,,,,,,,,523,523130,Commodity Contracts Dealing,523130,Commodity Contracts Dealing
,,,,,,,,524,524210,Insurance Agencies and Brokerages,524210,Insurance Agencies and Brokerages,,,,,,,,,,,,,523,523140,Commodity Contracts Brokerage,523140,Commodity Contracts Brokerage
,,,,,,,,524,524291,Claims Adjusting,524291,Claims Adjusting,,,,,,,,,,,,,523,523210,Securities and Commodity Exchanges,523210,Securities and Commodity Exchanges
,,,,,,,,524,524292,Third Party Administration of Insurance and Pension Funds,524292,Third Party Administration of Insurance and Pension Funds,,,,,,,,,,,,,523,523910,Miscellaneous Intermediation,523910,Miscellaneous Intermediation
,,,,,,,,524,524298,All Other Insurance Related Activities,524298,All Other Insurance Related Activities,,,,,,,,,,,,,523,523920,Portfolio Management,523920,Portfolio Management
,,,,,,,,525,525110,Pension Funds,525110,Pension Funds,,,,,,,,,,,,,523,523930,Investment Advice,523930,Investment Advice
,,,,,,,,525,525120,Health and Welfare Funds,525120,Health and Welfare Funds,,,,,,,,,,,,,523,523991,"Trust, Fiduciary, and Custody Activities",523991,"Trust, Fiduciary, and Custody Activities"
,,,,,,,,525,525190,Other Insurance Funds,525190,Other Insurance Funds,,,,,,,,,,,,,523,523999,Miscellaneous Financial Investment Activities,523999,Miscellaneous Financial Investment Activities
,,,,,,,,525,525910,Open-End Investment Funds,525910,Open-End Investment Funds,,,,,,,,,,,,,524,524113,Direct Life Insurance Carriers,524113,Direct Life Insurance Carriers
,,,,,,,,525,525920,"Trusts, Estates, and Agency Accounts",525920,"Trusts, Estates, and Agency Accounts",,,,,,,,,,,,,524,524114,Direct Health and Medical Insurance Carriers,524114,Direct Health and Medical Insurance Carriers
,,,,,,,,525,525990,Other Financial Vehicles,525990,Other Financial Vehicles,,,,,,,,,,,,,524,524126,Direct Property and Casualty Insurance Carriers,524126,Direct Property and Casualty Insurance Carriers
,,,,,,,,531,531110,Lessors of Residential Buildings and Dwellings,531110,Lessors of Residential Buildings and Dwellings,,,,,,,,,,,,,524,524127,Direct Title Insurance Carriers,524127,Direct Title Insurance Carriers
,,,,,,,,531,531120,Lessors of Nonresidential Buildings (excpet Miniwarehouses),531120,Lessors of Nonresidential Buildings (excpet Miniwarehouses),,,,,,,,,,,,,524,524128,"Other Direct Insurance (except Life, Health, and Medical) Carriers",524128,"Other Direct Insurance (except Life, Health, and Medical) Carriers"
,,,,,,,,531,531130,Lessors of Miniwarehouses and Self-Storage Units,531130,Lessors of Miniwarehouses and Self-Storage Units,,,,,,,,,,,,,524,524130,Reinsurance Carriers,524130,Reinsurance Carriers
,,,,,,,,531,531190,Lessors of Other Real Estate Property,531190,Lessors of Other Real Estate Property,,,,,,,,,,,,,524,524210,Insurance Agencies and Brokerages,524210,Insurance Agencies and Brokerages
,,,,,,,,531,531210,Offices of Real Estate Agents and Brokers,531210,Offices of Real Estate Agents and Brokers,,,,,,,,,,,,,524,524291,Claims Adjusting,524291,Claims Adjusting
,,,,,,,,531,531311,Residential Property Managers,531311,Residential Property Managers,,,,,,,,,,,,,524,524292,Third Party Administration of Insurance and Pension Funds,524292,Third Party Administration of Insurance and Pension Funds
,,,,,,,,531,531312,Nonresidential Property Managers,531312,Nonresidential Property Managers,,,,,,,,,,,,,524,524298,All Other Insurance Related Activities,524298,All Other Insurance Related Activities
,,,,,,,,531,531320,Offices of Real Estate Appraisers,531320,Offices of Real Estate Appraisers,,,,,,,,,,,,,525,525110,Pension Funds,525110,Pension Funds
,,,,,,,,531,531390,Other Activities Related to Real Estate,531390,Other Activities Related to Real Estate,,,,,,,,,,,,,525,525120,Health and Welfare Funds,525120,Health and Welfare Funds
,,,,,,,,532,532111,Passenger Car Rental,532111,Passenger Car Rental,,,,,,,,,,,,,525,525190,Other Insurance Funds,525190,Other Insurance Funds
,,,,,,,,532,532112,Passenger Car Leasing,532112,Passenger Car Leasing,,,,,,,,,,,,,525,525910,Open-End Investment Funds,525910,Open-End Investment Funds
,,,,,,,,532,532120,"Truck, Utility Trailer, and RV (Recreational Vehicle) Rental and Leasing",532120,"Truck, Utility Trailer, and RV (Recreational Vehicle) Rental and Leasing",,,,,,,,,,,,,525,525920,"Trusts, Estates, and Agency Accounts",525920,"Trusts, Estates, and Agency Accounts"
,,,,,,,,532,532210,Consumer Electronics and Appliances Rental,532210,Consumer Electronics and Appliances Rental,,,,,,,,,,,,,525,525930,Real Estate Investment Trusts - hybrid or mortgage REIT's primarily underwriting or investing in mortgages,525990,Other Financial Vehicles
,,,,,,,,532,532220,Formal Wear and Costume Rental,532220,Formal Wear and Costume Rental,,,,,,,,,,,,,525,525930,Real Estate Investment Trusts - hybrid or equity REIT's primarily leasing residentdial buildings and dwellings,531110,Lessors of Residential Buildings and Dwellings
,,,,,,,,532,532230,Video Tape and Disc Rental,532230,Video Tape and Disc Rental,,,,,,,,,,,,,525,525930,Real Estate Investment Trusts - hybrid or equity REIT's primarily leasing nonresidentdial buildings,531120,Lessors of Nonresidential Buildings (excpet Miniwarehouses)
,,,,,,,,532,532291,Home Health Equipment Rental,532291,Home Health Equipment Rental,,,,,,,,,,,,,525,525930,Real Estate Investment Trusts - hybrid or equity REIT's primarily leasing miniwarehouses or self-storage units,531130,Lessors of Miniwarehouses and Self-Storage Units
,,,,,,,,532,532292,Recreational Goods Rental,532292,Recreational Goods Rental,,,,,,,,,,,,,525,525930,Real Estate Investment Trusts - hybrid or equity REIT's primarily leasing other real estate property,531190,Lessors of Other Real Estate Property
,,,,,,,,532,532299,All Other Consumer Goods Rental,532299,All Other Consumer Goods Rental,,,,,,,,,,,,,525,525990,Other Financial Vehicles,525990,Other Financial Vehicles
,,,,,,,,532,532310,General Rental Centers,532310,General Rental Centers,,,,,,,,,,,,,531,531110,Lessors of Residential Buildings and Dwellings,531110,Lessors of Residential Buildings and Dwellings
,,,,,,,,532,532411,"Commercial Air, Rail, and Water Transportation Equipment Rental and Leasing",532411,"Commercial Air, Rail, and Water Transportation Equipment Rental and Leasing",,,,,,,,,,,,,531,531120,Lessors of Nonresidential Buildings (except Miniwarehouses),531120,Lessors of Nonresidential Buildings (except Miniwarehouses)
,,,,,,,,532,532412,"Construction, Mining, and Forestry Machinery and Equipment Rental and Leasing",532412,"Construction, Mining, and Forestry Machinery and Equipment Rental and Leasing",,,,,,,,,,,,,531,531130,Lessors of Miniwarehouses and Self-Storage Units,531130,Lessors of Miniwarehouses and Self-Storage Units
,,,,,,,,532,532420,Office Machinery and Equipment Rental and Leasing,532420,Office Machinery and Equipment Rental and Leasing,,,,,,,,,,,,,531,531190,Lessors of Other Real Estate Property,531190,Lessors of Other Real Estate Property
,,,,,,,,532,532490,Other Commercial and Industrial Machinery and Equipment Rental and Leasing,532490,Other Commercial and Industrial Machinery and Equipment Rental and Leasing,,,,,,,,,,,,,531,531210,Offices of Real Estate Agents and Brokers,531210,Offices of Real Estate Agents and Brokers
,,,,,,,,533,533110,Lessors of Nonfinancial Intangible Assets (except Copyrighted Works),533110,Lessors of Nonfinancial Intangible Assets (except Copyrighted Works),,,,,,,,,,,,,531,531311,Residential Property Managers,531311,Residential Property Managers
,,,,,,,,541,541110,Offices of Lawyers,541110,Offices of Lawyers,,,,,,,,,,,,,531,531312,Nonresidential Property Managers,531312,Nonresidential Property Managers
,,,,,,,,541,541120,Offices of Notaries,541120,Offices of Notaries,,,,,,,,,,,,,531,531320,Offices of Real Estate Appraisers,531320,Offices of Real Estate Appraisers
,,,,,,,,541,541191,Title Abstract and Settlement Offices,541191,Title Abstract and Settlement Offices,,,,,,,,,,,,,531,531390,Other Activities Related to Real Estate,531390,Other Activities Related to Real Estate
,,,,,,,,541,541199,All Other Legal Services,541199,All Other Legal Services,,,,,,,,,,,,,532,532111,Passenger Car Rental,532111,Passenger Car Rental
,,,,,,,,541,541211,Offices of Certified Public Accountants,541211,Offices of Certified Public Accountants,,,,,,,,,,,,,532,532112,Passenger Car Leasing,532112,Passenger Car Leasing
,,,,,,,,541,541213,Tax Preparation Services,541213,Tax Preparation Services,,,,,,,,,,,,,532,532120,"Truck, Utility Trailer, and RV (Recreational Vehicle) Rental and Leasing",532120,"Truck, Utility Trailer, and RV (Recreational Vehicle) Rental and Leasing"
,,,,,,,,541,541214,Payroll Services,541214,Payroll Services,,,,,,,,,,,,,532,532210,Consumer Electronics and Appliances Rental,532210,Consumer Electronics and Appliances Rental
,,,,,,,,541,541219,Other Accounting Services,541219,Other Accounting Services,,,,,,,,,,,,,532,532220,Formal Wear and Costume Rental,532220,Formal Wear and Costume Rental
,,,,,,,,541,541310,Architectural Services,541310,Architectural Services,,,,,,,,,,,,,532,532230,Video Tape and Disc Rental,532230,Video Tape and Disc Rental
,,,,,,,,541,541320,Landscape Architectural Services,541320,Landscape Architectural Services,,,,,,,,,,,,,532,532291,Home Health Equipment Rental,532291,Home Health Equipment Rental
,,,,,,,,541,541330,Engineering Services,541330,Engineering Services,,,,,,,,,,,,,532,532292,Recreational Goods Rental,532292,Recreational Goods Rental
,,,,,,,,541,541340,Drafting Services,541340,Drafting Services,,,,,,,,,,,,,532,532299,All Other Consumer Goods Rental,532299,All Other Consumer Goods Rental
,,,,,,,,541,541350,Building Inspection Services,541350,Building Inspection Services,,,,,,,,,,,,,532,532310,General Rental Centers,532310,General Rental Centers
,,,,,,,,541,541360,Geophysical Surveying and Mapping Services,541360,Geophysical Surveying and Mapping Services,,,,,,,,,,,,,532,532411,"Commercial Air, Rail, and Water Transportation Equipment Rental and Leasing",532411,"Commercial Air, Rail, and Water Transportation Equipment Rental and Leasing"
,,,,,,,,541,541370,Surveying and Mapping (except Geophysical) Services,541370,Surveying and Mapping (except Geophysical) Services,,,,,,,,,,,,,532,532412,"Construction, Mining, and Forestry Machinery and Equipment Rental and Leasing",532412,"Construction, Mining, and Forestry Machinery and Equipment Rental and Leasing"
,,,,,,,,541,541380,Testing Laboratories,541380,Testing Laboratories,,,,,,,,,,,,,532,532420,Office Machinery and Equipment Rental and Leasing,532420,Office Machinery and Equipment Rental and Leasing
,,,,,,,,541,541410,Interior Design Services,541410,Interior Design Services,,,,,,,,,,,,,532,532490,Other Commercial and Industrial Machinery and Equipment Rental and Leasing,532490,Other Commercial and Industrial Machinery and Equipment Rental and Leasing
,,,,,,,,541,541420,Industrial Design Services,541420,Industrial Design Services,,,,,,,,,,,,,533,533110,Lessors of Nonfinancial Intangible Assets (except Copyrighted Works),533110,Lessors of Nonfinancial Intangible Assets (except Copyrighted Works)
,,,,,,,,541,541430,Graphic Design Services,541430,Graphic Design Services,,,,,,,,,,,,,541,541110,Offices of Lawyers,541110,Offices of Lawyers
,,,,,,,,541,541490,Other Specialized Design Services,541490,Other Specialized Design Services,,,,,,,,,,,,,541,541120,Offices of Notaries,541120,Offices of Notaries
,,,,,,,,541,541511,Custom Computer Programming Services,541511,Custom Computer Programming Services,,,,,,,,,,,,,541,541191,Title Abstract and Settlement Offices,541191,Title Abstract and Settlement Offices
,,,,,,,,541,541512,Computer Systems Design Services,541512,Computer Systems Design Services,,,,,,,,,,,,,541,541199,All Other Legal Services,541199,All Other Legal Services
,,,,,,,,541,541513,Computer Facilities Management Services,541513,Computer Facilities Management Services,,,,,,,,,,,,,541,541211,Offices of Certified Public Accountants,541211,Offices of Certified Public Accountants
,,,,,,,,541,541519,Other Computer Related Services,541519,Other Computer Related Services,,,,,,,,,,,,,541,541213,Tax Preparation Services,541213,Tax Preparation Services
,,,,,,,,541,541611,Administrative Management and General Management Consulting Services,541611,Administrative Management and General Management Consulting Services,,,,,,,,,,,,,541,541214,Payroll Services,541214,Payroll Services
,,,,,,,,541,541612,Human Resources Consulting Services,541612,Human Resources Consulting Services,,,,,,,,,,,,,541,541219,Other Accounting Services,541219,Other Accounting Services
,,,,,,,,541,541613,Marketing Consulting Services,541613,Marketing Consulting Services,,,,,,,,,,,,,541,541310,Architectural Services,541310,Architectural Services
,,,,,,,,541,541614,"Process, Physical Distribution, and Logistics Consulting Services",541614,"Process, Physical Distribution, and Logistics Consulting Services",,,,,,,,,,,,,541,541320,Landscape Architectural Services,541320,Landscape Architectural Services
,,,,,,,,541,541618,Other Management Consulting Services,541618,Other Management Consulting Services,,,,,,,,,,,,,541,541330,Engineering Services,541330,Engineering Services
,,,,,,,,541,541620,Environmental Consulting Services,541620,Environmental Consulting Services,,,,,,,,,,,,,541,541340,Drafting Services,541340,Drafting Services
,,,,,,,,541,541690,Other Scientific and Technical Consulting Services,541690,Other Scientific and Technical Consulting Services,,,,,,,,,,,,,541,541350,Building Inspection Services,541350,Building Inspection Services
,,,,,,,,541,541711,Research and Development in Biotechnology,541711,Research and Development in Biotechnology,,,,,,,,,,,,,541,541360,Geophysical Surveying and Mapping Services,541360,Geophysical Surveying and Mapping Services
,,,,,,,,541,541712,"Research and Development in the Physical, Engineering, and Life Sciences (except Biotechnology)",541712,"Research and Development in the Physical, Engineering, and Life Sciences (except Biotechnology)",,,,,,,,,,,,,541,541370,Surveying and Mapping (except Geophysical) Services,541370,Surveying and Mapping (except Geophysical) Services
,,,,,,,,541,541720,Research and Development in the Social Sciences and Humanities,541720,Research and Development in the Social Sciences and Humanities,,,,,,,,,,,,,541,541380,Testing Laboratories,541380,Testing Laboratories
,,,,,,,,541,541810,Advertising Agencies,541810,Advertising Agencies,,,,,,,,,,,,,541,541410,Interior Design Services,541410,Interior Design Services
,,,,,,,,541,541820,Public Relations Agencies,541820,Public Relations Agencies,,,,,,,,,,,,,541,541420,Industrial Design Services,541420,Industrial Design Services
,,,,,,,,541,541830,Media Buying Agencies,541830,Media Buying Agencies,,,,,,,,,,,,,541,541430,Graphic Design Services,541430,Graphic Design Services
