,,,,,,,,333,333923,"Overhead Traveling Crane, Hoist, and Monorail System Manufacturing",333923,"Overhead Traveling Crane, Hoist, and Monorail System Manufacturing",,,,,,,,,,,,,333,333913,Measuring and Dispensing Pump Manufacturing,333913,Measuring and Dispensing Pump Manufacturing
,,,,,,,,333,333924,"Industrial Truck, Tractor, Trailer, and Stacker Machinery Manufacturing",333924,"Industrial Truck, Tractor, Trailer, and Stacker Machinery Manufacturing",,,,,,,,,,,,,333,333921,Elevator and Moving Stairway Manufacturing,333921,Elevator and Moving Stairway Manufacturing
,,,,,,,,333,333991,Power-Driven Handtool Manufacturing,333991,Power-Driven Handtool Manufacturing,,,,,,,,,,,,,333,333922,Conveyor and Conveying Equipment Manufacturing,333922,Conveyor and Conveying Equipment Manufacturing
,,,,,,,,333,333992,Welding and Soldering Equipment Manufacturing,333992,Welding and Soldering Equipment Manufacturing,,,,,,,,,,,,,333,333923,"Overhead Traveling Crane, Hoist, and Monorail System Manufacturing",333923,"Overhead Traveling Crane, Hoist, and Monorail System Manufacturing"
,,,,,,,,333,333993,Packaging Machinery Manufacturing,333993,Packaging Machinery Manufacturing,,,,,,,,,,,,,333,333924,"Industrial Truck, Tractor, Trailer, and Stacker Machinery Manufacturing",333924,"Industrial Truck, Tractor, Trailer, and Stacker Machinery Manufacturing"
,,,,,,,,333,333994,Industrial Process Furnace and Oven Manufacturing,333994,Industrial Process Furnace and Oven Manufacturing,,,,,,,,,,,,,333,333991,Power-Driven Handtool Manufacturing,333991,Power-Driven Handtool Manufacturing
,,,,,,,,333,333995,Fluid Power Cylinder and Actuator Manufacturing,333995,Fluid Power Cylinder and Actuator Manufacturing,,,,,,,,,,,,,333,333992,Welding and Soldering Equipment Manufacturing,333992,Welding and Soldering Equipment Manufacturing
,,,,,,,,333,333996,Fluid Power Pump and Motor Manufacturing,333996,Fluid Power Pump and Motor Manufacturing,,,,,,,,,,,,,333,333993,Packaging Machinery Manufacturing,333993,Packaging Machinery Manufacturing
,,,,,,,,333,333997,Scale and Balance Manufacturing,333997,Scale and Balance Manufacturing,,,,,,,,,,,,,333,333994,Industrial Process Furnace and Oven Manufacturing,333994,Industrial Process Furnace and Oven Manufacturing
,,,,,,,,333,333999,All Other Miscellaneous General Purpose Machinery Manufacturing,333999,All Other Miscellaneous General Purpose Machinery Manufacturing,,,,,,,,,,,,,333,333995,Fluid Power Cylinder and Actuator Manufacturing,333995,Fluid Power Cylinder and Actuator Manufacturing
,,,,,,,,334,334111,Electronic Computer Manufacturing,334111,Electronic Computer Manufacturing,,,,,,,,,,,,,333,333996,Fluid Power Pump and Motor Manufacturing,333996,Fluid Power Pump and Motor Manufacturing
,,,,,,,,334,334112,Computer Storage Device Manufacturing,334112,Computer Storage Device Manufacturing,,,,,,,,,,,,,333,333997,Scale and Balance (except Laboratory) Manufacturing,333997,Scale and Balance Manufacturing
,,,,,,,,334,334113,Computer Terminal Manufacturing,334118,Computer Terminal and Other Computer Peripheral Equipment Manufacturing,,,,,,,,,,,,,333,333999,All Other Miscellaneous General Purpose Machinery Manufacturing,333999,All Other Miscellaneous General Purpose Machinery Manufacturing
,,,,,,,,334,334119,Other Computer Peripheral Equipment Manufacturing - digital camera manufacturing,333316,Photographic and Photocopying Equipment Manufacturing,,,,,,,,,,,,,334,334111,Electronic Computer Manufacturing,334111,Electronic Computer Manufacturing
,,,,,,,,334,334119,Other Computer Peripheral Equipment Manufacturing - except digital camera manufacturing,334118,Computer Terminal and Other Computer Peripheral Equipment Manufacturing,,,,,,,,,,,,,334,334112,Computer Storage Device Manufacturing,334112,Computer Storage Device Manufacturing
,,,,,,,,334,334210,Telephone Apparatus Manufacturing,334210,Telephone Apparatus Manufacturing,,,,,,,,,,,,,334,334113,Computer Terminal Manufacturing,334113,Computer Terminal Manufacturing
,,,,,,,,334,334220,Radio and Television Broadcasting and Wireless Communications Equipment Manufacturing,334220,Radio and Television Broadcasting and Wireless Communications Equipment Manufacturing,,,,,,,,,,,,,334,334119,Other Computer Peripheral Equipment Manufacturing,334119,Other Computer Peripheral Equipment Manufacturing
,,,,,,,,334,334290,Other Communications Equipment Manufacturing,334290,Other Communications Equipment Manufacturing,,,,,,,,,,,,,334,334210,Telephone Apparatus Manufacturing,334210,Telephone Apparatus Manufacturing
,,,,,,,,334,334310,Audio and Video Equipment Manufacturing,334310,Audio and Video Equipment Manufacturing,,,,,,,,,,,,,334,334220,Radio and Television Broadcasting and Wireless Communications Equipment Manufacturing - except communications signal testing and evaluation equipment,334220,Radio and Television Broadcasting and Wireless Communications Equipment Manufacturing
,,,,,,,,334,334411,Electron Tube Manufacturing,334419,Other Electronic Component Manufacturing,,,,,,,,,,,,,334,334220,Radio and Television Broadcasting and Wireless Communications Equipment Manufacturing - communications signal testing and evaluation equipment,334515,Instrument Manufacturing for Measuring and Testing Electricity and Electrical Signals
,,,,,,,,334,334412,Bare Printed Circuit Board Manufacturing,334412,Bare Printed Circuit Board Manufacturing,,,,,,,,,,,,,334,334290,Other Communications Equipment Manufacturing,334290,Other Communications Equipment Manufacturing
,,,,,,,,334,334413,Semiconductor and Related Device Manufacturing,334413,Semiconductor and Related Device Manufacturing,,,,,,,,,,,,,334,334310,Audio and Video Equipment Manufacturing,334310,Audio and Video Equipment Manufacturing
,,,,,,,,334,334414,Electronic Capacitor Manufacturing,334416,"Capacitor, Resistor, Coil, Transformer, and Other Inductor Manufacturing",,,,,,,,,,,,,334,334411,Electron Tube Manufacturing,334411,Electron Tube Manufacturing
,,,,,,,,334,334415,Electronic Resistor Manufacturing,334416,"Capacitor, Resistor, Coil, Transformer, and Other Inductor Manufacturing",,,,,,,,,,,,,334,334412,Bare Printed Circuit Board Manufacturing,334412,Bare Printed Circuit Board Manufacturing
,,,,,,,,334,334416,"Electronic Coil, Transformer, and Other Inductor Manufacturing",334416,"Capacitor, Resistor, Coil, Transformer, and Other Inductor Manufacturing",,,,,,,,,,,,,334,334413,Semiconductor and Related Device Manufacturing,334413,Semiconductor and Related Device Manufacturing
,,,,,,,,334,334417,Electronic Connector Manufacturing,334417,Electronic Connector Manufacturing,,,,,,,,,,,,,334,334414,Electronic Capacitor Manufacturing,334414,Electronic Capacitor Manufacturing
,,,,,,,,334,334418,Printed Circuit Assembly (Electronic Assembly) Manufacturing,334418,Printed Circuit Assembly (Electronic Assembly) Manufacturing,,,,,,,,,,,,,334,334415,Electronic Resistor Manufacturing,334415,Electronic Resistor Manufacturing
,,,,,,,,334,334419,Other Electronic Component Manufacturing,334419,Other Electronic Component Manufacturing,,,,,,,,,,,,,334,334416,"Electronic Coil, Transformer, and Other Inductor Manufacturing",334416,"Electronic Coil, Transformer, and Other Inductor Manufacturing"
,,,,,,,,334,334510,Electromedical and Electrotherapeutic Apparatus Manufacturing,334510,Electromedical and Electrotherapeutic Apparatus Manufacturing,,,,,,,,,,,,,334,334417,Electronic Connector Manufacturing,334417,Electronic Connector Manufacturing
,,,,,,,,334,334511,"Search, Detection, Navigation, Guidance, Aeronautical, and Nautical System and Instrument Manufacturing",334511,"Search, Detection, Navigation, Guidance, Aeronautical, and Nautical System and Instrument Manufacturing",,,,,,,,,,,,,334,334418,Printed Circuit Assembly (Electronic Assembly) Manufacturing,334418,Printed Circuit Assembly (Electronic Assembly) Manufacturing
,,,,,,,,334,334512,"Automatic Environmental Control Manufacturing for Residential, Commercial, and Appliance Use",334512,"Automatic Environmental Control Manufacturing for Residential, Commercial, and Appliance Use",,,,,,,,,,,,,334,334419,Other Electronic Component Manufacturing,334419,Other Electronic Component Manufacturing
,,,,,,,,334,334513,"Instruments and Related Products Manufacturing for Measuring, Displaying, and Controlling Industrial Process Variables",334513,"Instruments and Related Products Manufacturing for Measuring, Displaying, and Controlling Industrial Process Variables",,,,,,,,,,,,,334,334510,Electromedical and Electrotherapeutic Apparatus Manufacturing,334510,Electromedical and Electrotherapeutic Apparatus Manufacturing
,,,,,,,,334,334514,Totalizing Fluid Meter and Counting Device Manufacturing,334514,Totalizing Fluid Meter and Counting Device Manufacturing,,,,,,,,,,,,,334,334511,"Search, Detection, Navigation, Guidance, Aeronautical, and Nautical System and Instrument Manufacturing",334511,"Search, Detection, Navigation, Guidance, Aeronautical, and Nautical System and Instrument Manufacturing"
,,,,,,,,334,334515,Instrument Manufacturing for Measuring and Testing Electricity and Electrical Signals,334515,Instrument Manufacturing for Measuring and Testing Electricity and Electrical Signals,,,,,,,,,,,,,334,334512,"Automatic Environmental Control Manufacturing for Residential, Commercial, and Appliance Use",334512,"Automatic Environmental Control Manufacturing for Residential, Commercial, and Appliance Use"
,,,,,,,,334,334516,Analytical Laboratory Instrument Manufacturing,334516,Analytical Laboratory Instrument Manufacturing,,,,,,,,,,,,,334,334513,"Instruments and Related Products Manufacturing for Measuring, Displaying, and Controlling Industrial Process Variables",334513,"Instruments and Related Products Manufacturing for Measuring, Displaying, and Controlling Industrial Process Variables"
,,,,,,,,334,334517,Irradiation Apparatus Manufacturing,334517,Irradiation Apparatus Manufacturing,,,,,,,,,,,,,334,334514,Totalizing Fluid Meter and Counting Device Manufacturing,334514,Totalizing Fluid Meter and Counting Device Manufacturing
,,,,,,,,334,334518,"Watch, Clock, and Part Manufacturing",334519,Other Measuring and Controlling Device Manufacturing,,,,,,,,,,,,,334,334515,Instrument Manufacturing for Measuring and Testing Electricity and Electrical Signals,334515,Instrument Manufacturing for Measuring and Testing Electricity and Electrical Signals
,,,,,,,,334,334519,Other Measuring and Controlling Device Manufacturing,334519,Other Measuring and Controlling Device Manufacturing,,,,,,,,,,,,,334,334516,Analytical Laboratory Instrument Manufacturing,334516,Analytical Laboratory Instrument Manufacturing
,,,,,,,,334,334611,Software Reproducing,334614,"Software and Other Prerecorded Compact Disc, Tape, and Record Reproducing ",,,,,,,,,,,,,334,334517,Irradiation Apparatus Manufacturing,334517,Irradiation Apparatus Manufacturing
,,,,,,,,334,334612,"Prerecorded Compact Disc (except Software), Tape, and Record Reproducing",334614,"Software and Other Prerecorded Compact Disc, Tape, and Record Reproducing ",,,,,,,,,,,,,334,334518,"Watch, Clock, and Part Manufacturing",334518,"Watch, Clock, and Part Manufacturing"
,,,,,,,,334,334613,Magnetic and Optical Recording Media Manufacturing,334613,Blank Magnetic and Optical Recording Media Manufacturing,,,,,,,,,,,,,334,334519,Other Measuring and Controlling Device Manufacturing,334519,Other Measuring and Controlling Device Manufacturing
,,,,,,,,335,335110,Electric Lamp Bulb and Part Manufacturing,335110,Electric Lamp Bulb and Part Manufacturing,,,,,,,,,,,,,334,334611,Software Reproducing,334611,Software Reproducing
,,,,,,,,335,335121,Residential Electric Lighting Fixture Manufacturing,335121,Residential Electric Lighting Fixture Manufacturing,,,,,,,,,,,,,334,334612,"Prerecorded Compact Disc (except Software), Tape, and Record Reproducing",334612,"Prerecorded Compact Disc (except Software), Tape, and Record Reproducing"
,,,,,,,,335,335122,"Commercial, Industrial, and Institutional Electric Lighting Fixture Manufacturing",335122,"Commercial, Industrial, and Institutional Electric Lighting Fixture Manufacturing",,,,,,,,,,,,,334,334613,Magnetic and Optical Recording Media Manufacturing,334613,Magnetic and Optical Recording Media Manufacturing
,,,,,,,,335,335129,Other Lighting Equipment Manufacturing,335129,Other Lighting Equipment Manufacturing,,,,,,,,,,,,,335,335110,Electric Lamp Bulb and Part Manufacturing,335110,Electric Lamp Bulb and Part Manufacturing
,,,,,,,,335,335211,Electric Housewares and Household Fan Manufacturing,335210,Small Electrical Appliance Manufacturing,,,,,,,,,,,,,335,335121,Residential Electric Lighting Fixture Manufacturing,335121,Residential Electric Lighting Fixture Manufacturing
,,,,,,,,335,335212,Household Vacuum Cleaner Manufacturing,335210,Small Electrical Appliance Manufacturing,,,,,,,,,,,,,335,335122,"Commercial, Industrial, and Institutional Electric Lighting Fixture Manufacturing",335122,"Commercial, Industrial, and Institutional Electric Lighting Fixture Manufacturing"
,,,,,,,,335,335221,Household Cooking Appliance Manufacturing,335221,Household Cooking Appliance Manufacturing,,,,,,,,,,,,,335,335129,Other Lighting Equipment Manufacturing,335129,Other Lighting Equipment Manufacturing
,,,,,,,,335,335222,Household Refrigerator and Home Freezer Manufacturing,335222,Household Refrigerator and Home Freezer Manufacturing,,,,,,,,,,,,,335,335211,Electric Housewares and Household Fan Manufacturing,335211,Electric Housewares and Household Fan Manufacturing
,,,,,,,,335,335224,Household Laundry Equipment Manufacturing,335224,Household Laundry Equipment Manufacturing,,,,,,,,,,,,,335,335212,Household Vacuum Cleaner Manufacturing,335212,Household Vacuum Cleaner Manufacturing
,,,,,,,,335,335228,Other Major Household Appliance Manufacturing,335228,Other Major Household Appliance Manufacturing,,,,,,,,,,,,,335,335221,Household Cooking Appliance Manufacturing,335221,Household Cooking Appliance Manufacturing
,,,,,,,,335,335311,"Power, Distribution, and Specialty Transformer Manufacturing",335311,"Power, Distribution, and Specialty Transformer Manufacturing",,,,,,,,,,,,,335,335222,Household Refrigerator and Home Freezer Manufacturing,335222,Household Refrigerator and Home Freezer Manufacturing
,,,,,,,,335,335312,Motor and Generator Manufacturing,335312,Motor and Generator Manufacturing,,,,,,,,,,,,,335,335224,Household Laundry Equipment Manufacturing,335224,Household Laundry Equipment Manufacturing
,,,,,,,,335,335313,Switchgear and Switchboard Apparatus Manufacturing,335313,Switchgear and Switchboard Apparatus Manufacturing,,,,,,,,,,,,,335,335228,Other Major Household Appliance Manufacturing,335228,Other Major Household Appliance Manufacturing
,,,,,,,,335,335314,Relay and Industrial Control Manufacturing,335314,Relay and Industrial Control Manufacturing,,,,,,,,,,,,,335,335311,"Power, Distribution, and Specialty Transformer Manufacturing",335311,"Power, Distribution, and Specialty Transformer Manufacturing"
,,,,,,,,335,335911,Storage Battery Manufacturing,335911,Storage Battery Manufacturing,,,,,,,,,,,,,335,335312,Motor and Generator Manufacturing,335312,Motor and Generator Manufacturing
,,,,,,,,335,335912,Primary Battery Manufacturing,335912,Primary Battery Manufacturing,,,,,,,,,,,,,335,335313,Switchgear and Switchboard Apparatus Manufacturing,335313,Switchgear and Switchboard Apparatus Manufacturing
,,,,,,,,335,335921,Fiber Optic Cable Manufacturing,335921,Fiber Optic Cable Manufacturing,,,,,,,,,,,,,335,335314,Relay and Industrial Control Manufacturing,335314,Relay and Industrial Control Manufacturing
,,,,,,,,335,335929,Other Communication and Energy Wire Manufacturing,335929,Other Communication and Energy Wire Manufacturing,,,,,,,,,,,,,335,335911,Storage Battery Manufacturing,335911,Storage Battery Manufacturing
,,,,,,,,335,335931,Current-Carrying Wiring Device Manufacturing,335931,Current-Carrying Wiring Device Manufacturing,,,,,,,,,,,,,335,335912,Primary Battery Manufacturing,335912,Primary Battery Manufacturing
,,,,,,,,335,335932,Noncurrent-Carrying Wiring Device Manufacturing,335932,Noncurrent-Carrying Wiring Device Manufacturing,,,,,,,,,,,,,335,335921,Fiber Optic Cable Manufacturing,335921,Fiber Optic Cable Manufacturing
,,,,,,,,335,335991,Carbon and Graphite Product Manufacturing,335991,Carbon and Graphite Product Manufacturing,,,,,,,,,,,,,335,335929,Other Communication and Energy Wire Manufacturing,335929,Other Communication and Energy Wire Manufacturing
,,,,,,,,335,335999,All Other Miscellaneous Electrical Equipment and Component Manufacturing,335999,All Other Miscellaneous Electrical Equipment and Component Manufacturing,,,,,,,,,,,,,335,335931,Current-Carrying Wiring Device Manufacturing,335931,Current-Carrying Wiring Device Manufacturing
,,,,,,,,336,336111,Automobile Manufacturing,336111,Automobile Manufacturing,,,,,,,,,,,,,335,335932,Noncurrent-Carrying Wiring Device Manufacturing,335932,Noncurrent-Carrying Wiring Device Manufacturing
,,,,,,,,336,336112,Light Truck and Utility Vehicle Manufacturing,336112,Light Truck and Utility Vehicle Manufacturing,,,,,,,,,,,,,335,335991,Carbon and Graphite Product Manufacturing,335991,Carbon and Graphite Product Manufacturing
,,,,,,,,336,336120,Heavy Duty Truck Manufacturing,336120,Heavy Duty Truck Manufacturing,,,,,,,,,,,,,335,335999,All Other Miscellaneous Electrical Equipment and Component Manufacturing,335999,All Other Miscellaneous Electrical Equipment and Component Manufacturing
,,,,,,,,336,336211,Motor Vehicle Body Manufacturing,336211,Motor Vehicle Body Manufacturing,,,,,,,,,,,,,336,336111,Automobile Manufacturing,336111,Automobile Manufacturing
,,,,,,,,336,336212,Truck Trailer Manufacturing,336212,Truck Trailer Manufacturing,,,,,,,,,,,,,336,336112,Light Truck and Utility Vehicle Manufacturing,336112,Light Truck and Utility Vehicle Manufacturing
,,,,,,,,336,336213,Motor Home Manufacturing,336213,Motor Home Manufacturing,,,,,,,,,,,,,336,336120,Heavy Duty Truck Manufacturing,336120,Heavy Duty Truck Manufacturing
,,,,,,,,336,336214,Travel Trailer and Camper Manufacturing,336214,Travel Trailer and Camper Manufacturing,,,,,,,,,,,,,336,336211,Motor Vehicle Body Manufacturing,336211,Motor Vehicle Body Manufacturing
,,,,,,,,336,336311,"Carburetor, Piston, Piston Ring, and Valve Manufacturing",336310,Motor Vehicle Gasoline Engine and Engine Parts Manufacturing,,,,,,,,,,,,,336,336212,Truck Trailer Manufacturing,336212,Truck Trailer Manufacturing
,,,,,,,,336,336312,Gasoline Engine and Engine Parts Manufacturing,336310,Motor Vehicle Gasoline Engine and Engine Parts Manufacturing,,,,,,,,,,,,,336,336213,Motor Home Manufacturing,336213,Motor Home Manufacturing
,,,,,,,,336,336321,Vehicular Lighting Equipment Manufacturing,336320,Motor Vehicle Electrical and Electronic Equipment Manufacturing,,,,,,,,,,,,,336,336214,Travel Trailer and Camper Manufacturing,336214,Travel Trailer and Camper Manufacturing
,,,,,,,,336,336322,Other Motor Vehicle Electrical and Electronic Equipment Manufacturing,336320,Motor Vehicle Electrical and Electronic Equipment Manufacturing,,,,,,,,,,,,,336,336311,"Carburetor, Piston, Piston Ring, and Valve Manufacturing",336311,"Carburetor, Piston, Piston Ring, and Valve Manufacturing"
,,,,,,,,336,336330,Motor Vehicle Steering and Suspension Components (except Spring) Manufacturing,336330,Motor Vehicle Steering and Suspension Components (except Spring) Manufacturing,,,,,,,,,,,,,336,336312,Gasoline Engine and Engine Parts Manufacturing,336312,Gasoline Engine and Engine Parts Manufacturing
,,,,,,,,336,336340,Motor Vehicle Brake System Manufacturing,336340,Motor Vehicle Brake System Manufacturing,,,,,,,,,,,,,336,336321,Vehicular Lighting Equipment Manufacturing,336321,Vehicular Lighting Equipment Manufacturing
,,,,,,,,336,336350,Motor Vehicle Transmission and Power Train Parts Manufacturing,336350,Motor Vehicle Transmission and Power Train Parts Manufacturing,,,,,,,,,,,,,336,336322,Other Motor Vehicle Electrical and Electronic Equipment Manufacturing,336322,Other Motor Vehicle Electrical and Electronic Equipment Manufacturing
,,,,,,,,336,336360,Motor Vehicle Seating and Interior Trim Manufacturing,336360,Motor Vehicle Seating and Interior Trim Manufacturing,,,,,,,,,,,,,336,336330,Motor Vehicle Steering and Suspension Components (except Spring) Manufacturing,336330,Motor Vehicle Steering and Suspension Components (except Spring) Manufacturing
,,,,,,,,336,336370,Motor Vehicle Metal Stamping,336370,Motor Vehicle Metal Stamping,,,,,,,,,,,,,336,336340,Motor Vehicle Brake System Manufacturing,336340,Motor Vehicle Brake System Manufacturing
,,,,,,,,336,336391,Motor Vehicle Air-Conditioning Manufacturing,336390,Other Motor Vehicle Parts Manufacturing,,,,,,,,,,,,,336,336350,Motor Vehicle Transmission and Power Train Parts Manufacturing,336350,Motor Vehicle Transmission and Power Train Parts Manufacturing
,,,,,,,,336,336399,All Other Motor Vehicle Parts Manufacturing,336390,Other Motor Vehicle Parts Manufacturing,,,,,,,,,,,,,336,336360,Motor Vehicle Seating and Interior Trim Manufacturing,336360,Motor Vehicle Seating and Interior Trim Manufacturing
,,,,,,,,336,336411,Aircraft Manufacturing,336411,Aircraft Manufacturing,,,,,,,,,,,,,336,336370,Motor Vehicle Metal Stamping,336370,Motor Vehicle Metal Stamping
,,,,,,,,336,336412,Aircraft Engine and Engine Parts Manufacturing,336412,Aircraft Engine and Engine Parts Manufacturing,,,,,,,,,,,,,336,336391,Motor Vehicle Air-Conditioning Manufacturing,336391,Motor Vehicle Air-Conditioning Manufacturing
,,,,,,,,336,336413,Other Aircraft Parts and Auxiliary Equipment Manufacturing,336413,Other Aircraft Parts and Auxiliary Equipment Manufacturing,,,,,,,,,,,,,336,336399,All Other Motor Vehicle Parts Manufacturing,336399,All Other Motor Vehicle Parts Manufacturing
,,,,,,,,336,336414,Guided Missile and Space Vehicle Manufacturing,336414,Guided Missile and Space Vehicle Manufacturing,,,,,,,,,,,,,336,336411,Aircraft Manufacturing,336411,Aircraft Manufacturing
,,,,,,,,336,336415,Guided Missile and Space Vehicle Propulsion Unit and Propulsion Unit Parts Manufacturing,336415,Guided Missile and Space Vehicle Propulsion Unit and Propulsion Unit Parts Manufacturing,,,,,,,,,,,,,336,336412,Aircraft Engine and Engine Parts Manufacturing,336412,Aircraft Engine and Engine Parts Manufacturing
,,,,,,,,336,336419,Other Guided Missile and Space Vehicle Parts and Auxiliary Equipment Manufacturing,336419,Other Guided Missile and Space Vehicle Parts and Auxiliary Equipment Manufacturing,,,,,,,,,,,,,336,336413,Other Aircraft Parts and Auxiliary Equipment Manufacturing,336413,Other Aircraft Parts and Auxiliary Equipment Manufacturing
,,,,,,,,336,336510,Railroad Rolling Stock Manufacturing,336510,Railroad Rolling Stock Manufacturing,,,,,,,,,,,,,336,336414,Guided Missile and Space Vehicle Manufacturing,336414,Guided Missile and Space Vehicle Manufacturing
,,,,,,,,336,336611,Ship Building and Repairing,336611,Ship Building and Repairing,,,,,,,,,,,,,336,336415,Guided Missile and Space Vehicle Propulsion Unit and Propulsion Unit Parts Manufacturing,336415,Guided Missile and Space Vehicle Propulsion Unit and Propulsion Unit Parts Manufacturing
,,,,,,,,336,336612,Boat Building,336612,Boat Building,,,,,,,,,,,,,336,336419,Other Guided Missile and Space Vehicle Parts and Auxiliary Equipment Manufacturing,336419,Other Guided Missile and Space Vehicle Parts and Auxiliary Equipment Manufacturing
,,,,,,,,336,336991,"Motorcycle, Bicycle, and Parts Manufacturing",336991,"Motorcycle, Bicycle, and Parts Manufacturing",,,,,,,,,,,,,336,336510,Railroad Rolling Stock Manufacturing,336510,Railroad Rolling Stock Manufacturing
,,,,,,,,336,336992,"Military Armored Vehicle, Tank, and Tank Component Manufacturing",336992,"Military Armored Vehicle, Tank, and Tank Component Manufacturing",,,,,,,,,,,,,336,336611,Ship Building and Repairing,336611,Ship Building and Repairing
,,,,,,,,336,336999,All Other Transportation Equipment Manufacturing,336999,All Other Transportation Equipment Manufacturing,,,,,,,,,,,,,336,336612,Boat Building,336612,Boat Building
,,,,,,,,337,337110,Wood Kitchen Cabinet and Countertop Manufacturing,337110,Wood Kitchen Cabinet and Countertop Manufacturing,,,,,,,,,,,,,336,336991,"Motorcycle, Bicycle, and Parts Manufacturing",336991,"Motorcycle, Bicycle, and Parts Manufacturing"
,,,,,,,,337,337121,Upholstered Household Furniture Manufacturing,337121,Upholstered Household Furniture Manufacturing,,,,,,,,,,,,,336,336992,"Military Armored Vehicle, Tank, and Tank Component Manufacturing",336992,"Military Armored Vehicle, Tank, and Tank Component Manufacturing"
,,,,,,,,337,337122,Nonupholstered Wood Household Furniture Manufacturing,337122,Nonupholstered Wood Household Furniture Manufacturing,,,,,,,,,,,,,336,336999,All Other Transportation Equipment Manufacturing,336999,All Other Transportation Equipment Manufacturing
,,,,,,,,337,337124,Metal Household Furniture Manufacturing,337124,Metal Household Furniture Manufacturing,,,,,,,,,,,,,337,337110,Wood Kitchen Cabinet and Countertop Manufacturing,337110,Wood Kitchen Cabinet and Countertop Manufacturing
,,,,,,,,337,337125,Household Furniture (except Wood and Metal) Manufacturing,337125,Household Furniture (except Wood and Metal) Manufacturing,,,,,,,,,,,,,337,337121,Upholstered Household Furniture Manufacturing,337121,Upholstered Household Furniture Manufacturing
,,,,,,,,337,337127,Institutional Furniture Manufacturing,337127,Institutional Furniture Manufacturing,,,,,,,,,,,,,337,337122,Nonupholstered Wood Household Furniture Manufacturing,337122,Nonupholstered Wood Household Furniture Manufacturing
,,,,,,,,337,337129,"Wood Television, Radio, and Sewing Machine Cabinet Manufacturing",321999,All Other Miscellaneous Wood Product Manufacturing,,,,,,,,,,,,,337,337124,Metal Household Furniture Manufacturing,337124,Metal Household Furniture Manufacturing
,,,,,,,,337,337211,Wood Office Furniture Manufacturing,337211,Wood Office Furniture Manufacturing,,,,,,,,,,,,,337,337125,Household Furniture (except Wood and Metal) Manufacturing,337125,Household Furniture (except Wood and Metal) Manufacturing
