,,,,,,,,321,321219,Reconstituted Wood Product Manufacturing,321219,Reconstituted Wood Product Manufacturing,,,,,,,,,,,,,321,321219,Reconstituted Wood Product Manufacturing,321219,Reconstituted Wood Product Manufacturing
,,,,,,,,321,321911,Wood Window and Door Manufacturing,321911,Wood Window and Door Manufacturing,,,,,,,,,,,,,321,321911,Wood Window and Door Manufacturing,321911,Wood Window and Door Manufacturing
,,,,,,,,321,321912,"Cut Stock, Resawing Lumber, and Planing",321912,"Cut Stock, Resawing Lumber, and Planing",,,,,,,,,,,,,321,321912,"Cut Stock, Resawing Lumber, and Planing",321912,"Cut Stock, Resawing Lumber, and Planing"
,,,,,,,,321,321918,Other Millwork (including Flooring),321918,Other Millwork (including Flooring),,,,,,,,,,,,,321,321918,Other Millwork (including Flooring),321918,Other Millwork (including Flooring)
,,,,,,,,321,321920,Wood Container and Pallet Manufacturing,321920,Wood Container and Pallet Manufacturing,,,,,,,,,,,,,321,321920,Wood Container and Pallet Manufacturing,321920,Wood Container and Pallet Manufacturing
,,,,,,,,321,321991,Manufactured Home (Mobile Home) Manufacturing,321991,Manufactured Home (Mobile Home) Manufacturing,,,,,,,,,,,,,321,321991,Manufactured Home (Mobile Home) Manufacturing,321991,Manufactured Home (Mobile Home) Manufacturing
,,,,,,,,321,321992,Prefabricated Wood Building Manufacturing,321992,Prefabricated Wood Building Manufacturing,,,,,,,,,,,,,321,321992,Prefabricated Wood Building Manufacturing,321992,Prefabricated Wood Building Manufacturing
,,,,,,,,321,321999,All Other Miscellaneous Wood Product Manufacturing,321999,All Other Miscellaneous Wood Product Manufacturing,,,,,,,,,,,,,321,321999,All Other Miscellaneous Wood Product Manufacturing,321999,All Other Miscellaneous Wood Product Manufacturing
,,,,,,,,322,322110,Pulp Mills,322110,Pulp Mills,,,,,,,,,,,,,322,322110,Pulp Mills,322110,Pulp Mills
,,,,,,,,322,322121,Paper (except Newsprint) Mills,322121,Paper (except Newsprint) Mills,,,,,,,,,,,,,322,322121,Paper (except Newsprint) Mills,322121,Paper (except Newsprint) Mills
,,,,,,,,322,322122,Newsprint Mills,322122,Newsprint Mills,,,,,,,,,,,,,322,322122,Newsprint Mills,322122,Newsprint Mills
,,,,,,,,322,322130,Paperboard Mills,322130,Paperboard Mills,,,,,,,,,,,,,322,322130,Paperboard Mills,322130,Paperboard Mills
,,,,,,,,322,322211,Corrugated and Solid Fiber Box Manufacturing,322211,Corrugated and Solid Fiber Box Manufacturing,,,,,,,,,,,,,322,322211,Corrugated and Solid Fiber Box Manufacturing,322211,Corrugated and Solid Fiber Box Manufacturing
,,,,,,,,322,322212,Folding Paperboard Box Manufacturing,322212,Folding Paperboard Box Manufacturing,,,,,,,,,,,,,322,322212,Folding Paperboard Box Manufacturing,322212,Folding Paperboard Box Manufacturing
,,,,,,,,322,322213,Setup Paperboard Box Manufacturing,322219,Other Paperboard Container Manufacturing,,,,,,,,,,,,,322,322213,Setup Paperboard Box Manufacturing,322213,Setup Paperboard Box Manufacturing
,,,,,,,,322,322214,"Fiber Can, Tube, Drum, and Similar Products Manufacturing",322219,Other Paperboard Container Manufacturing,,,,,,,,,,,,,322,322214,"Fiber Can, Tube, Drum, and Similar Products Manufacturing",322214,"Fiber Can, Tube, Drum, and Similar Products Manufacturing"
,,,,,,,,322,322215,Nonfolding Sanitary Food Container Manufacturing,322219,Other Paperboard Container Manufacturing,,,,,,,,,,,,,322,322215,Nonfolding Sanitary Food Container Manufacturing,322215,Nonfolding Sanitary Food Container Manufacturing
,,,,,,,,322,322221,Coated and Laminated Packaging Paper Manufacturing,322220,Paper Bag and Coated and Treated Paper Manufacturing,,,,,,,,,,,,,322,322221,Coated and Laminated Packaging Paper and Plastics Film Manufacturing,322221,Coated and Laminated Packaging Paper Manufacturing
,,,,,,,,322,322222,Coated and Laminated Paper Manufacturing,322220,Paper Bag and Coated and Treated Paper Manufacturing,,,,,,,,,,,,,322,322222,Coated and Laminated Paper Manufacturing,322222,Coated and Laminated Paper Manufacturing
,,,,,,,,322,322223,Coated Paper Bag and Pouch Manufacturing,322220,Paper Bag and Coated and Treated Paper Manufacturing,,,,,,,,,,,,,322,322223,"Plastics, Foil, and Coated Paper Bag Manufacturing",322223,Coated Paper Bag and Pouch Manufacturing
,,,,,,,,322,322224,Uncoated Paper and Multiwall Bag Manufacturing,322220,Paper Bag and Coated and Treated Paper Manufacturing,,,,,,,,,,,,,322,322224,Uncoated Paper and Multiwall Bag Manufacturing,322224,Uncoated Paper and Multiwall Bag Manufacturing
,,,,,,,,322,322225,Laminated Aluminum Foil Manufacturing for Flexible Packaging Uses,322220,Paper Bag and Coated and Treated Paper Manufacturing,,,,,,,,,,,,,322,322225,Laminated Aluminum Foil Manufacturing for Flexible Packaging Uses,322225,Laminated Aluminum Foil Manufacturing for Flexible Packaging Uses
,,,,,,,,322,322226,Surface-Coated Paperboard Manufacturing,322220,Paper Bag and Coated and Treated Paper Manufacturing,,,,,,,,,,,,,322,322226,Surface-Coated Paperboard Manufacturing,322226,Surface-Coated Paperboard Manufacturing
,,,,,,,,322,322231,Die-Cut Paper and Paperboard Office Supplies Manufacturing,322230,Stationery Product Manufacturing,,,,,,,,,,,,,322,322231,Die-Cut Paper and Paperboard Office Supplies Manufacturing,322231,Die-Cut Paper and Paperboard Office Supplies Manufacturing
,,,,,,,,322,322232,Envelope Manufacturing,322230,Stationery Product Manufacturing,,,,,,,,,,,,,322,322232,Envelope Manufacturing,322232,Envelope Manufacturing
,,,,,,,,322,322233,"Stationery, Tablet, and Related Product Manufacturing",322230,Stationery Product Manufacturing,,,,,,,,,,,,,322,322233,"Stationery, Tablet, and Related Product Manufacturing",322233,"Stationery, Tablet, and Related Product Manufacturing"
,,,,,,,,322,322291,Sanitary Paper Product Manufacturing,322291,Sanitary Paper Product Manufacturing,,,,,,,,,,,,,322,322291,Sanitary Paper Product Manufacturing,322291,Sanitary Paper Product Manufacturing
,,,,,,,,322,322299,All Other Converted Paper Product Manufacturing,322299,All Other Converted Paper Product Manufacturing,,,,,,,,,,,,,322,322299,All Other Converted Paper Product Manufacturing,322299,All Other Converted Paper Product Manufacturing
,,,,,,,,323,323110,Commercial Lithographic Printing,323111,Commercial Printing (except Screen and Books),,,,,,,,,,,,,323,323110,Commercial Lithographic Printing,323110,Commercial Lithographic Printing
,,,,,,,,323,323111,Commercial Gravure Printing,323111,Commercial Printing (except Screen and Books),,,,,,,,,,,,,323,323111,Commercial Gravure Printing,323111,Commercial Gravure Printing
,,,,,,,,323,323112,Commercial Flexographic Printing,323111,Commercial Printing (except Screen and Books),,,,,,,,,,,,,323,323112,Commercial Flexographic Printing,323112,Commercial Flexographic Printing
,,,,,,,,323,323113,Commercial Screen Printing,323113,Commercial Screen Printing,,,,,,,,,,,,,323,323113,Commercial Screen Printing,323113,Commercial Screen Printing
,,,,,,,,323,323114,Quick Printing,323111,Commercial Printing (except Screen and Books),,,,,,,,,,,,,323,323114,Quick Printing,323114,Quick Printing
,,,,,,,,323,323115,Digital Printing,323111,Commercial Printing (except Screen and Books),,,,,,,,,,,,,323,323115,Digital Printing,323115,Digital Printing
,,,,,,,,323,323116,Manifold Business Forms Printing,323111,Commercial Printing (except Screen and Books),,,,,,,,,,,,,323,323116,Manifold Business Forms Printing,323116,Manifold Business Forms Printing
,,,,,,,,323,323117,Books Printing,323117,Books Printing,,,,,,,,,,,,,323,323117,Books Printing,323117,Books Printing
,,,,,,,,323,323118,"Blankbook, Looseleaf Binders, and Devices Manufacturing",323111,Commercial Printing (except Screen and Books),,,,,,,,,,,,,323,323118,"Blankbook, Looseleaf Binders, and Devices Manufacturing",323118,"Blankbook, Looseleaf Binders, and Devices Manufacturing"
,,,,,,,,323,323119,Other Commercial Printing,323111,Commercial Printing (except Screen and Books),,,,,,,,,,,,,323,323119,Other Commercial Printing,323119,Other Commercial Printing
,,,,,,,,323,323121,Tradebinding and Related Work,323120,Support Activites for Printing,,,,,,,,,,,,,323,323121,Tradebinding and Related Work,323121,Tradebinding and Related Work
,,,,,,,,323,323122,Prepress Services,323120,Support Activites for Printing,,,,,,,,,,,,,323,323122,Prepress Services,323122,Prepress Services
,,,,,,,,324,324110,Petroleum Refineries,324110,Petroleum Refineries,,,,,,,,,,,,,324,324110,Petroleum Refineries,324110,Petroleum Refineries
,,,,,,,,324,324121,Asphalt Paving Mixture and Block Manufacturing,324121,Asphalt Paving Mixture and Block Manufacturing,,,,,,,,,,,,,324,324121,Asphalt Paving Mixture and Block Manufacturing,324121,Asphalt Paving Mixture and Block Manufacturing
,,,,,,,,324,324122,Asphalt Shingle and Coating Materials Manufacturing,324122,Asphalt Shingle and Coating Materials Manufacturing,,,,,,,,,,,,,324,324122,Asphalt Shingle and Coating Materials Manufacturing,324122,Asphalt Shingle and Coating Materials Manufacturing
,,,,,,,,324,324191,Petroleum Lubricating Oil and Grease Manufacturing,324191,Petroleum Lubricating Oil and Grease Manufacturing,,,,,,,,,,,,,324,324191,Petroleum Lubricating Oil and Grease Manufacturing,324191,Petroleum Lubricating Oil and Grease Manufacturing
,,,,,,,,324,324199,All Other Petroleum and Coal Products Manufacturing,324199,All Other Petroleum and Coal Products Manufacturing,,,,,,,,,,,,,324,324199,All Other Petroleum and Coal Products Manufacturing,324199,All Other Petroleum and Coal Products Manufacturing
,,,,,,,,325,325110,Petrochemical Manufacturing,325110,Petrochemical Manufacturing,,,,,,,,,,,,,325,325110,Petrochemical Manufacturing,325110,Petrochemical Manufacturing
,,,,,,,,325,325120,Industrial Gas Manufacturing,325120,Industrial Gas Manufacturing,,,,,,,,,,,,,325,325120,Industrial Gas Manufacturing,325120,Industrial Gas Manufacturing
,,,,,,,,325,325131,Inorganic Dye and Pigment Manufacturing,325130,Synthetic Dye and Pigment Manufacturing,,,,,,,,,,,,,325,325131,Inorganic Dye and Pigment Manufacturing,325131,Inorganic Dye and Pigment Manufacturing
,,,,,,,,325,325132,Synthetic Organic Dye and Pigment Manufacturing,325130,Synthetic Dye and Pigment Manufacturing,,,,,,,,,,,,,325,325132,Synthetic Organic Dye and Pigment Manufacturing,325132,Synthetic Organic Dye and Pigment Manufacturing
,,,,,,,,325,325181,Alkalies and Chlorine Manufacturing,325180,Other Basic Inorganic Chemical Manufacturing,,,,,,,,,,,,,325,325181,Alkalies and Chlorine Manufacturing,325181,Alkalies and Chlorine Manufacturing
,,,,,,,,325,325182,Carbon Black Manufacturing,325180,Other Basic Inorganic Chemical Manufacturing,,,,,,,,,,,,,325,325182,Carbon Black Manufacturing,325182,Carbon Black Manufacturing
,,,,,,,,325,325188,All Other Basic Inorganic Chemical Manufacturing,325180,Other Basic Inorganic Chemical Manufacturing,,,,,,,,,,,,,325,325188,All Other Basic Inorganic Chemical Manufacturing,325188,All Other Basic Inorganic Chemical Manufacturing
,,,,,,,,325,325191,Gum and Wood Chemical Manufacturing,325194,"Cyclic Crude, Intermediate, and Gum and Wood Chemical Manufacturing",,,,,,,,,,,,,325,325191,Gum and Wood Chemical Manufacturing,325191,Gum and Wood Chemical Manufacturing
,,,,,,,,325,325192,Cyclic Crude and Intermediate Manufacturing,325194,"Cyclic Crude, Intermediate, and Gum and Wood Chemical Manufacturing",,,,,,,,,,,,,325,325192,Cyclic Crude and Intermediate Manufacturing,325192,Cyclic Crude and Intermediate Manufacturing
,,,,,,,,325,325193,Ethyl Alcohol Manufacturing,325193,Ethyl Alcohol Manufacturing,,,,,,,,,,,,,325,325193,Ethyl Alcohol Manufacturing,325193,Ethyl Alcohol Manufacturing
,,,,,,,,325,325199,All Other Basic Organic Chemical Manufacturing,325199,All Other Basic Organic Chemical Manufacturing,,,,,,,,,,,,,325,325199,All Other Basic Organic Chemical Manufacturing,325199,All Other Basic Organic Chemical Manufacturing
,,,,,,,,325,325211,Plastics Material and Resin Manufacturing,325211,Plastics Material and Resin Manufacturing,,,,,,,,,,,,,325,325211,Plastics Material and Resin Manufacturing,325211,Plastics Material and Resin Manufacturing
,,,,,,,,325,325212,Synthetic Rubber Manufacturing,325212,Synthetic Rubber Manufacturing,,,,,,,,,,,,,325,325212,Synthetic Rubber Manufacturing,325212,Synthetic Rubber Manufacturing
,,,,,,,,325,325221,Cellulosic Organic Fiber Manufacturing,325220,Artificial and Synthetic Fibers and Filaments Manufacturing,,,,,,,,,,,,,325,325221,Cellulosic Organic Fiber Manufacturing,325221,Cellulosic Organic Fiber Manufacturing
,,,,,,,,325,325222,Noncellulosic Organic Fiber Manufacturing,325220,Artificial and Synthetic Fibers and Filaments Manufacturing,,,,,,,,,,,,,325,325222,Noncellulosic Organic Fiber Manufacturing,325222,Noncellulosic Organic Fiber Manufacturing
,,,,,,,,325,325311,Nitrogenous Fertilizer Manufacturing,325311,Nitrogenous Fertilizer Manufacturing,,,,,,,,,,,,,325,325311,Nitrogenous Fertilizer Manufacturing,325311,Nitrogenous Fertilizer Manufacturing
,,,,,,,,325,325312,Phosphatic Fertilizer Manufacturing,325312,Phosphatic Fertilizer Manufacturing,,,,,,,,,,,,,325,325312,Phosphatic Fertilizer Manufacturing,325312,Phosphatic Fertilizer Manufacturing
,,,,,,,,325,325314,Fertilizer (Mixing Only) Manufacturing,325314,Fertilizer (Mixing Only) Manufacturing,,,,,,,,,,,,,325,325314,Fertilizer (Mixing Only) Manufacturing,325314,Fertilizer (Mixing Only) Manufacturing
,,,,,,,,325,325320,Pesticide and Other Agricultural Chemical Manufacturing,325320,Pesticide and Other Agricultural Chemical Manufacturing,,,,,,,,,,,,,325,325320,Pesticide and Other Agricultural Chemical Manufacturing,325320,Pesticide and Other Agricultural Chemical Manufacturing
,,,,,,,,325,325411,Medicinal and Botanical Manufacturing,325411,Medicinal and Botanical Manufacturing,,,,,,,,,,,,,325,325411,Medicinal and Botanical Manufacturing,325411,Medicinal and Botanical Manufacturing
,,,,,,,,325,325412,Pharmaceutical Preparation Manufacturing,325412,Pharmaceutical Preparation Manufacturing,,,,,,,,,,,,,325,325412,Pharmaceutical Preparation Manufacturing,325412,Pharmaceutical Preparation Manufacturing
,,,,,,,,325,325413,In-Vitro Diagnostic Substance Manufacturing,325413,In-Vitro Diagnostic Substance Manufacturing,,,,,,,,,,,,,325,325413,In-Vitro Diagnostic Substance Manufacturing,325413,In-Vitro Diagnostic Substance Manufacturing
,,,,,,,,325,325414,Biological Product (except Diagnostic) Manufacturing,325414,Biological Product (except Diagnostic) Manufacturing,,,,,,,,,,,,,325,325414,Biological Product (except Diagnostic) Manufacturing,325414,Biological Product (except Diagnostic) Manufacturing
,,,,,,,,325,325510,Paint and Coating Manufacturing,325510,Paint and Coating Manufacturing,,,,,,,,,,,,,325,325510,Paint and Coating Manufacturing,325510,Paint and Coating Manufacturing
,,,,,,,,325,325520,Adhesive Manufacturing,325520,Adhesive Manufacturing,,,,,,,,,,,,,325,325520,Adhesive Manufacturing,325520,Adhesive Manufacturing
,,,,,,,,325,325611,Soap and Other Detergent Manufacturing,325611,Soap and Other Detergent Manufacturing,,,,,,,,,,,,,325,325611,Soap and Other Detergent Manufacturing,325611,Soap and Other Detergent Manufacturing
,,,,,,,,325,325612,Polish and Other Sanitation Good Manufacturing,325612,Polish and Other Sanitation Good Manufacturing,,,,,,,,,,,,,325,325612,Polish and Other Sanitation Good Manufacturing,325612,Polish and Other Sanitation Good Manufacturing
,,,,,,,,325,325613,Surface Active Agent Manufacturing,325613,Surface Active Agent Manufacturing,,,,,,,,,,,,,325,325613,Surface Active Agent Manufacturing,325613,Surface Active Agent Manufacturing
,,,,,,,,325,325620,Toilet Preparation Manufacturing,325620,Toilet Preparation Manufacturing,,,,,,,,,,,,,325,325620,Toilet Preparation Manufacturing,325620,Toilet Preparation Manufacturing
,,,,,,,,325,325910,Printing Ink Manufacturing,325910,Printing Ink Manufacturing,,,,,,,,,,,,,325,325910,Printing Ink Manufacturing,325910,Printing Ink Manufacturing
,,,,,,,,325,325920,Explosives Manufacturing,325920,Explosives Manufacturing,,,,,,,,,,,,,325,325920,Explosives Manufacturing,325920,Explosives Manufacturing
,,,,,,,,325,325991,Custom Compounding of Purchased Resins,325991,Custom Compounding of Purchased Resins,,,,,,,,,,,,,325,325991,Custom Compounding of Purchased Resins,325991,Custom Compounding of Purchased Resins
,,,,,,,,325,325992,"Photographic Film, Paper, Plate, and Chemical Manufacturing",325992,"Photographic Film, Paper, Plate, and Chemical Manufacturing",,,,,,,,,,,,,325,325992,"Photographic Film, Paper, Plate, and Chemical Manufacturing",325992,"Photographic Film, Paper, Plate, and Chemical Manufacturing"
,,,,,,,,325,325998,All Other Miscellaneous Chemical Product and Preparation Manufacturing,325998,All Other Miscellaneous Chemical Product and Preparation Manufacturing,,,,,,,,,,,,,325,325998,All Other Miscellaneous Chemical Product and Preparation Manufacturing,325998,All Other Miscellaneous Chemical Product and Preparation Manufacturing
,,,,,,,,326,326111,Plastics Bag and Pouch Manufacturing,326111,Plastics Bag and Pouch Manufacturing,,,,,,,,,,,,,326,326111,Plastics Bag Manufacturing,326111,Plastics Bag and Pouch Manufacturing
,,,,,,,,326,326112,Plastics Packaging Film and Sheet (including Laminated) Manufacturing,326112,Plastics Packaging Film and Sheet (including Laminated) Manufacturing,,,,,,,,,,,,,326,326112,Plastics Packaging Film and Sheet (including Laminated) Manufacturing,326112,Plastics Packaging Film and Sheet (including Laminated) Manufacturing
,,,,,,,,326,326113,Unlaminated Plastics Film and Sheet (except Packaging) Manufacturing,326113,Unlaminated Plastics Film and Sheet (except Packaging) Manufacturing,,,,,,,,,,,,,326,326113,Unlaminated Plastics Film and Sheet (except Packaging) Manufacturing,326113,Unlaminated Plastics Film and Sheet (except Packaging) Manufacturing
,,,,,,,,326,326121,Unlaminated Plastics Profile Shape Manufacturing,326121,Unlaminated Plastics Profile Shape Manufacturing,,,,,,,,,,,,,326,326121,Unlaminated Plastics Profile Shape Manufacturing,326121,Unlaminated Plastics Profile Shape Manufacturing
,,,,,,,,326,326122,Plastics Pipe and Pipe Fitting Manufacturing,326122,Plastics Pipe and Pipe Fitting Manufacturing,,,,,,,,,,,,,326,326122,Plastics Pipe and Pipe Fitting Manufacturing,326122,Plastics Pipe and Pipe Fitting Manufacturing
,,,,,,,,326,326130,"Laminated Plastics Plate, Sheet (except Packaging), and Shape Manufacturing",326130,"Laminated Plastics Plate, Sheet (except Packaging), and Shape Manufacturing",,,,,,,,,,,,,326,326130,"Laminated Plastics Plate, Sheet (except Packaging), and Shape Manufacturing",326130,"Laminated Plastics Plate, Sheet (except Packaging), and Shape Manufacturing"
,,,,,,,,326,326140,Polystyrene Foam Product Manufacturing,326140,Polystyrene Foam Product Manufacturing,,,,,,,,,,,,,326,326140,Polystyrene Foam Product Manufacturing,326140,Polystyrene Foam Product Manufacturing
,,,,,,,,326,326150,Urethane and Other Foam Product (except Polystyrene) Manufacturing,326150,Urethane and Other Foam Product (except Polystyrene) Manufacturing,,,,,,,,,,,,,326,326150,Urethane and Other Foam Product (except Polystyrene) Manufacturing,326150,Urethane and Other Foam Product (except Polystyrene) Manufacturing
,,,,,,,,326,326160,Plastics Bottle Manufacturing,326160,Plastics Bottle Manufacturing,,,,,,,,,,,,,326,326160,Plastics Bottle Manufacturing,326160,Plastics Bottle Manufacturing
,,,,,,,,326,326191,Plastics Plumbing Fixture Manufacturing,326191,Plastics Plumbing Fixture Manufacturing,,,,,,,,,,,,,326,326191,Plastics Plumbing Fixture Manufacturing,326191,Plastics Plumbing Fixture Manufacturing
,,,,,,,,326,326192,Resilient Floor Covering Manufacturing,326199,All Other Plastics Product Manufacturing,,,,,,,,,,,,,326,326192,Resilient Floor Covering Manufacturing,326192,Resilient Floor Covering Manufacturing
,,,,,,,,326,326199,All Other Plastics Product Manufacturing,326199,All Other Plastics Product Manufacturing,,,,,,,,,,,,,326,326199,All Other Plastics Product Manufacturing - except inflatable plastics boats,326199,All Other Plastics Product Manufacturing
,,,,,,,,326,326211,Tire Manufacturing (except Retreading),326211,Tire Manufacturing (except Retreading),,,,,,,,,,,,,326,326199,All Other Plastics Product Manufacturing - inflatable plastics boats,336612,Boat Building
,,,,,,,,326,326212,Tire Retreading,326212,Tire Retreading,,,,,,,,,,,,,326,326211,Tire Manufacturing (except Retreading),326211,Tire Manufacturing (except Retreading)
,,,,,,,,326,326220,Rubber and Plastics Hoses and Belting Manufacturing,326220,Rubber and Plastics Hoses and Belting Manufacturing,,,,,,,,,,,,,326,326212,Tire Retreading,326212,Tire Retreading
,,,,,,,,326,326291,Rubber Product Manufacturing for Mechanical Use,326291,Rubber Product Manufacturing for Mechanical Use,,,,,,,,,,,,,326,326220,Rubber and Plastics Hoses and Belting Manufacturing,326220,Rubber and Plastics Hoses and Belting Manufacturing
,,,,,,,,326,326299,All Other Rubber Product Manufacturing,326299,All Other Rubber Product Manufacturing,,,,,,,,,,,,,326,326291,Rubber Product Manufacturing for Mechanical Use - except rubber tubing for mechanical use,326291,Rubber Product Manufacturing for Mechanical Use
,,,,,,,,327,327111,Vitreous China Plumbing Fixture and China and Earthenware Bathroom Accessories Manufacturing,327110,"Pottery, Ceramics, and Plumbing Fixture Manufacturing",,,,,,,,,,,,,326,326291,Rubber Product Manufacturing for Mechanical Use - rubber tubing for mechanical use,326299,All Other Rubber Product Manufacturing
,,,,,,,,327,327112,"Vitreous China, Fine Earthenware, and Other Pottery Product Manufacturing",327110,"Pottery, Ceramics, and Plumbing Fixture Manufacturing",,,,,,,,,,,,,326,326299,All Other Rubber Product Manufacturing - except inflatable rubber boats,326299,All Other Rubber Product Manufacturing
,,,,,,,,327,327113,Porcelain Electrical Supply Manufacturing,327110,"Pottery, Ceramics, and Plumbing Fixture Manufacturing",,,,,,,,,,,,,326,326299,All Other Rubber Product Manufacturing - inflatable rubber boats,336612,Boat Building
,,,,,,,,327,327121,Brick and Structural Clay Tile Manufacturing,327120,Clay Building Material and Refractories Manufacturing,,,,,,,,,,,,,327,327111,Vitreous China Plumbing Fixture and China and Earthenware Bathroom Accessories Manufacturing,327111,Vitreous China Plumbing Fixture and China and Earthenware Bathroom Accessories Manufacturing
,,,,,,,,327,327122,Ceramic Wall and Floor Tile Manufacturing,327120,Clay Building Material and Refractories Manufacturing,,,,,,,,,,,,,327,327112,"Vitreous China, Fine Earthenware, and Other Pottery Product Manufacturing",327112,"Vitreous China, Fine Earthenware, and Other Pottery Product Manufacturing"
,,,,,,,,327,327123,Other Structural Clay Product Manufacturing,327120,Clay Building Material and Refractories Manufacturing,,,,,,,,,,,,,327,327113,Porcelain Electrical Supply Manufacturing,327113,Porcelain Electrical Supply Manufacturing
,,,,,,,,327,327124,Clay Refractory Manufacturing,327120,Clay Building Material and Refractories Manufacturing,,,,,,,,,,,,,327,327121,Brick and Structural Clay Tile Manufacturing,327121,Brick and Structural Clay Tile Manufacturing
,,,,,,,,327,327125,Nonclay Refractory Manufacturing,327120,Clay Building Material and Refractories Manufacturing,,,,,,,,,,,,,327,327122,Ceramic Wall and Floor Tile Manufacturing,327122,Ceramic Wall and Floor Tile Manufacturing
,,,,,,,,327,327211,Flat Glass Manufacturing,327211,Flat Glass Manufacturing,,,,,,,,,,,,,327,327123,Other Structural Clay Product Manufacturing,327123,Other Structural Clay Product Manufacturing
,,,,,,,,327,327212,Other Pressed and Blown Glass and Glassware Manufacturing,327212,Other Pressed and Blown Glass and Glassware Manufacturing,,,,,,,,,,,,,327,327124,Clay Refractory Manufacturing,327124,Clay Refractory Manufacturing
,,,,,,,,327,327213,Glass Container Manufacturing,327213,Glass Container Manufacturing,,,,,,,,,,,,,327,327125,Nonclay Refractory Manufacturing,327125,Nonclay Refractory Manufacturing
,,,,,,,,327,327215,Glass Product Manufacturing Made of Purchased Glass,327215,Glass Product Manufacturing Made of Purchased Glass,,,,,,,,,,,,,327,327211,Flat Glass Manufacturing,327211,Flat Glass Manufacturing
,,,,,,,,327,327310,Cement Manufacturing,327310,Cement Manufacturing,,,,,,,,,,,,,327,327212,Other Pressed and Blown Glass and Glassware Manufacturing,327212,Other Pressed and Blown Glass and Glassware Manufacturing
,,,,,,,,327,327320,Ready-Mix Concrete Manufacturing,327320,Ready-Mix Concrete Manufacturing,,,,,,,,,,,,,327,327213,Glass Container Manufacturing,327213,Glass Container Manufacturing
,,,,,,,,327,327331,Concrete Block and Brick Manufacturing,327331,Concrete Block and Brick Manufacturing,,,,,,,,,,,,,327,327215,Glass Product Manufacturing Made of Purchased Glass,327215,Glass Product Manufacturing Made of Purchased Glass
,,,,,,,,327,327332,Concrete Pipe Manufacturing,327332,Concrete Pipe Manufacturing,,,,,,,,,,,,,327,327310,Cement Manufacturing,327310,Cement Manufacturing
,,,,,,,,327,327390,Other Concrete Product Manufacturing,327390,Other Concrete Product Manufacturing,,,,,,,,,,,,,327,327320,Ready-Mix Concrete Manufacturing,327320,Ready-Mix Concrete Manufacturing
,,,,,,,,327,327410,Lime Manufacturing,327410,Lime Manufacturing,,,,,,,,,,,,,327,327331,Concrete Block and Brick Manufacturing,327331,Concrete Block and Brick Manufacturing
,,,,,,,,327,327420,Gypsum Product Manufacturing,327420,Gypsum Product Manufacturing,,,,,,,,,,,,,327,327332,Concrete Pipe Manufacturing,327332,Concrete Pipe Manufacturing
,,,,,,,,327,327910,Abrasive Product Manufacturing,327910,Abrasive Product Manufacturing,,,,,,,,,,,,,327,327390,Other Concrete Product Manufacturing,327390,Other Concrete Product Manufacturing
,,,,,,,,327,327991,Cut Stone and Stone Product Manufacturing,327991,Cut Stone and Stone Product Manufacturing,,,,,,,,,,,,,327,327410,Lime Manufacturing,327410,Lime Manufacturing
,,,,,,,,327,327992,Ground or Treated Mineral and Earth Manufacturing,327992,Ground or Treated Mineral and Earth Manufacturing,,,,,,,,,,,,,327,327420,Gypsum Product Manufacturing,327420,Gypsum Product Manufacturing
