"","Primary.Export.Product.NAICS","Product.Description"
"1","111110","Soybean Farming"
"2","111120","Oilseed (except Soybean) Farming"
"3","111130","Dry Pea and Bean Farming"
"4","111140","Wheat Farming"
"5","111150","Corn Farming"
"6","111160","Rice Farming"
"7","111191","Oilseed and Grain Combination Farming"
"8","111199","All Other Grain Farming"
"9","111211","Potato Farming"
"10","111219","Other Vegetable (except Potato) and Melon Farming"
"11","111320","Citrus (except Orange) Groves"
"12","111331","Apple Orchards"
"13","111332","Grape Vineyards"
"14","111334","Berry (except Strawberry) Farming"
"15","111335","Tree Nut Farming"
"16","111336","Fruit and Tree Nut Combination Farming"
"17","111339","Other Noncitrus Fruit Farming"
"18","111411","Mushroom Production"
"19","111419","Other Food Crops Grown Under Cover"
"20","111421","Nursery and Tree Production"
"21","111422","Floriculture Production"
"22","111920","Cotton Farming"
"23","111940","Hay Farming"
"24","111992","Peanut Farming"
"25","111998","All Other Miscellaneous Crop Farming"
"26","112111","Beef Cattle Ranching and Farming"
"27","112112","Cattle Feedlots"
"28","112120","Dairy Cattle and Milk Production"
"29","112210","Hog and Pig Farming"
"30","112310","Chicken Egg Production"
"31","112320","Broilers and Other Meat Type Chicken Production"
"32","112330","Turkey Production"
"33","112340","Poultry Hatcheries"
"34","112390","Other Poultry Production"
"35","112511","Finfish Farming and Fish Hatcheries"
"36","112512","Shellfish Farming"
"37","112519","Other Aquaculture"
"38","112910","Apiculture"
"39","112920","Horses and Other Equine Production"
"40","112990","All Other Animal Production"
"41","113110","Timber Tract Operations"
"42","113210","Forest Nurseries and Gathering of Forest Products"
"43","113310","Logging"
"44","114111","Finfish Fishing"
"45","114112","Shellfish Fishing"
"46","114119","Other Marine Fishing"
"47","115111","Cotton Ginning"
"48","115112","Soil Preparation, Planting, and Cultivating"
"49","115113","Crop Harvesting, Primarily by Machine"
"50","115114","Postharvest Crop Activities (except Cotton Ginning)"
"51","115116","Farm Management Services"
"52","115210","Support Activities for Animal Production"
"53","115310","Support Activities for Forestry"
"54","119","Cash Grains - NEC"
"55","1381","Drilling Oil and Gas Wells"
"56","1382","Oil and Gas Field Exploration Services"
"57","1389","Oil and Gas Field Services - NEC"
"58","1542","Non-Residential Other Than Industrial and Warehous"
"59","1623","Water - Sewer - Pipeline - and Communications and Pow"
"60","1629","Heavy Construction - NEC"
"61","173","Tree Nuts"
"62","1731","Electrical Work"
"63","1771","Concrete Work"
"64","1791","Structural Steel Erection"
"65","2034","Dried and Dehydrated Fruits - Vegetables - and Soup"
"66","2048","Prepared Feeds and Feed Ingredients for Animals an"
"67","2064","Candy and Other Confectionery Products"
"68","2077","Animal and Marine Fats and Oils"
"69","2079","Shortening - Table Oils - Margarine - NEC"
"70","2092","Prepared Fresh or Frozen Fish and Seafood"
"71","2096","Potato Chips - Corn Chips - and Similar Snacks"
"72","2099","Food Preparations - NEC"
"73","211111","Crude Petroleum And Natural Gas Extraction"
"74","211112","Natural Gas Liquid Extraction"
"75","212111","Bituminous Coal and Lignite Surface Mining"
"76","212112","Bituminous Coal Underground Mining"
"77","212113","Anthracite Mining"
"78","212210","Iron Ore Mining"
"79","212221","Gold Ore Mining"
"80","212234","Copper Ore And Nickel Ore Mining"
"81","212299","All Other Metal Ore Mining"
"82","212311","Dimension Stone Mining and Quarrying"
"83","212312","Crushed and Broken Limestone Mining and Quarrying"
"84","212319","Other Crushed and Broken Stone Mining and Quarrying"
"85","212321","Construction Sand and Gravel Mining"
"86","212322","Industrial Sand Mining"
"87","212325","Clay and Ceramic and Refractory Minerals Mining"
"88","212391","Potash, Soda, and Borate Mineral Mining"
"89","212393","Other Chemical and Fertilizer Mineral Mining"
"90","212399","All Other Nonmetallic Mineral Mining"
"91","213111","Drilling Oil and Gas Wells"
"92","213112","Support Activities for Oil and Gas Operations"
"93","213113","Support Activities for Coal Mining"
"94","213114","Support Activities for Metal Mining"
"95","213115","Support Activities for Nonmetallic Minerals (except Fuels) Mining"
"96","2141","Tobacco Stemming and Redrying"
"97","221112","Fossil Fuel Electric Power Generation"
"98","221113","Nuclear Electric Power Generation"
"99","221114","Solar Electric Power Generation"
"100","221116","Geothermal Electric Power Generation"
"101","221119","Other Electric Power Generation"
"102","221121","Electric Bulk Power Transmission and Control"
"103","221122","Electric Power Distribution"
"104","221210","Natural Gas Distribution"
"105","221310","Water Supply and Irrigation Systems"
"106","221320","Sewage Treatment Facilities"
"107","221330","Steam and Air-Conditioning Supply"
"108","2281","Yarn Spinning Mills"
"109","2295","Coated Fabrics - Not Rubberized"
"110","2297","Nonwoven Fabrics"
"111","2299","Textile Goods - NEC"
"112","2341","Women's - Misses' - Children's - and Infants - Underga"
"113","236115","New Single-Family Housing Construction (except For-Sale Builders)"
"114","236116","New Multifamily Housing Construction (except For-Sale Builders)"
"115","236117","New Housing For-Sale Builders"
"116","236118","Residential Remodelers"
"117","236210","Industrial Building Construction"
"118","236220","Commercial and Institutional Building Construction"
"119","237110","Water and Sewer Line and Related Structures Construction"
"120","237120","Oil and Gas Pipeline and Related Structures Construction"
"121","237130","Power and Communication Line and Related Structures Construction"
"122","237310","Highway, Street, and Bridge Construction"
"123","237990","Other Heavy and Civil Engineering Construction"
"124","238110","Poured Concrete Foundation and Structure Contractors"
"125","238120","Structural Steel and Precast Concrete Contractors"
"126","238130","Framing Contractors"
"127","238140","Masonry Contractors"
"128","238150","Glass and Glazing Contractors"
"129","238160","Roofing Contractors"
"130","238190","Other Foundation, Structure, and Building Exterior Contractors"
"131","238210","Electrical Contractors and Other Wiring Installation Contractors"
"132","238220","Plumbing, Heating, and Air-Conditioning Contractors"
"133","238290","Other Building Equipment Contractors"
"134","238310","Drywall and Insulation Contractors"
"135","238320","Painting and Wall Covering Contractors"
"136","238330","Flooring Contractors"
"137","238340","Tile and Terrazzo Contractors"
"138","238350","Finish Carpentry Contractors"
"139","238390","Other Building Finishing Contractors"
"140","238910","Site Preparation Contractors"
"141","238990","All Other Specialty Trade Contractors"
"142","2394","Canvas and Related Products"
"143","2396","Automotive Trimmings - Apparel Findings - and Relate"
"144","2421","Sawmills and Planing Mills - General"
"145","2426","Hardwood Dimension and Flooring Mills"
"146","2435","Hardwood Veneer and Plywood"
"147","2439","Structural Wood - NEC"
"148","2452","Prefabricated Wood Buildings and Components"
"149","2499","Wood Products - NEC"
"150","2621","Paper Mills"
"151","2657","Folding Paperboard Boxes - including Sanitary"
"152","2679","Converted Paper and Paperboard Products - NEC"
"153","2741","Miscellaneous Publishing"
"154","2759","Commercial Printing - NEC"
"155","2789","Bookbinding and Related Work"
"156","2813","Industrial Gases"
"157","2819","Industrial Inorganic Chemicals - NEC"
"158","2821","Plastics Materials - Synthetic Resins - and Nonvulca"
"159","2833","Medicinal Chemicals and Botanical Products"
"160","2834","Pharmaceutical Preparations"
"161","2835","In Vitro and In Vivo Diagnostic Substances"
"162","2844","Perfumes - Cosmetics - and Other Toilet Preparations"
"163","2869","Industrial Organic Chemicals - NEC"
"164","2873","Nitrogenous Fertilizers"
"165","2891","Adhesives and Sealants"
"166","2899","Chemicals and Chemical Preparations - NEC"
"167","2992","Lubricating Oils and Greases"
"168","3053","Gaskets - Packing - and Sealing Devices"
"169","3069","Fabricated Rubber Products - NEC"
"170","3080","Miscellaneous Plastics Film and Sheet"
"171","3081","Unsupported Plastics Film and Sheet"
"172","3083","Laminated Plastics Plate - Sheet - and Profile Shape"
"173","3086","Plastics Foam Products"
"174","3087","Custom Compounding of Purchased Plastics Resins"
"175","3089","Plastics Products - NEC"
"176","3111","Leather Tanning and Finishing"
"177","311111","Dog and Cat Food Manufacturing"
"178","311119","Other Animal Food Manufacturing"
"179","311211","Flour Milling"
"180","311212","Rice Milling"
"181","311213","Malt Manufacturing"
"182","311221","Wet Corn Milling and Starch Manufacturing"
"183","311222","Soybean Processing"
"184","311223","Other Oilseed Processing"
"185","311224","Soybean and Other Oilseed Processing"
"186","311225","Fats and Oils Refining and Blending"
"187","311230","Breakfast Cereal Manufacturing"
"188","311312","Cane Sugar Refining"
"189","311320","Chocolate And Confectionery Manufacturing From Ca"
"190","311330","Confectionery Manufacturing From Purchased Chocol"
"191","311340","Nonchocolate Confectionery Manufacturing"
"192","311351","Chocolate and Confectionery Manufacturing from Cacao Beans"
"193","311352","Confectionery Manufacturing from Purchased Chocolate"
"194","311411","Frozen Fruit, Juice, and Vegetable Manufacturing"
"195","311412","Frozen Specialty Food Manufacturing"
"196","311421","Fruit and Vegetable Canning"
"197","311422","Specialty Canning"
"198","311423","Dried and Dehydrated Food Manufacturing"
"199","311511","Fluid Milk Manufacturing"
"200","311512","Creamery Butter Manufacturing"
"201","311513","Cheese Manufacturing"
"202","311514","Dry, Condensed, and Evaporated Dairy Product Manufacturing"
"203","311520","Ice Cream and Frozen Dessert Manufacturing"
"204","311611","Animal (except Poultry) Slaughtering"
"205","311612","Meat Processed from Carcasses"
"206","311613","Rendering and Meat Byproduct Processing"
"207","311615","Poultry Processing"
"208","311710","Seafood Product Preparation and Packaging"
"209","311711","Seafood Canning"
"210","311712","Fresh And Frozen Seafood Processing"
"211","311811","Retail Bakeries"
"212","311812","Commercial Bakeries"
"213","311813","Frozen Cakes, Pies, and Other Pastries Manufacturing"
"214","311821","Cookie and Cracker Manufacturing"
"215","311823","Dry Pasta Manufacturing"
"216","311830","Tortilla Manufacturing"
"217","311911","Roasted Nuts and Peanut Butter Manufacturing"
"218","311919","Other Snack Food Manufacturing"
"219","311920","Coffee and Tea Manufacturing"
"220","311930","Flavoring Syrup and Concentrate Manufacturing"
"221","311941","Mayonnaise, Dressing, and Other Prepared Sauce Manufacturing"
"222","311942","Spice and Extract Manufacturing"
"223","311991","Perishable Prepared Food Manufacturing"
"224","311999","All Other Miscellaneous Food Manufacturing"
"225","312111","Soft Drink Manufacturing"
"226","312112","Bottled Water Manufacturing"
"227","312113","Ice Manufacturing"
"228","312120","Breweries"
"229","312130","Wineries"
"230","312140","Distilleries"
"231","312230","Tobacco Manufacturing"
"232","313110","Fiber, Yarn, and Thread Mills"
"233","313111","Yarn Spinning Mills"
"234","313112","Yarn Texturizing, Throwing, And Twisting Mills"
"235","313113","Thread Mills"
"236","313210","Broadwoven Fabric Mills"
"237","313221","Narrow Fabric Mills"
"238","313230","Nonwoven Fabric Mills"
"239","313240","Knit Fabric Mills"
"240","313241","Weft Knit Fabric Mills"
"241","313249","Other Knit Fabric And Lace Mills"
"242","313310","Textile and Fabric Finishing Mills"
"243","313311","Broadwoven Fabric Finishing Mills"
"244","313312","Textile And Fabric Finishing (Except Broadwoven F"
"245","313320","Fabric Coating Mills"
"246","314110","Carpet and Rug Mills"
"247","314121","Curtain And Drapery Mills"
"248","314129","Other Household Textile Product Mills"
"249","314910","Textile Bag and Canvas Mills"
"250","314912","Canvas And Related Product Mills"
"251","314991","Rope, Cordage, And Twine Mills"
"252","314994","Rope, Cordage, Twine, Tire Cord, and Tire Fabric Mills"
"253","314999","All Other Miscellaneous Textile Product Mills"
"254","315110","Hosiery and Sock Mills"
"255","315119","Other Hosiery And Sock Mills"
"256","315190","Other Apparel Knitting Mills"
"257","315191","Outerwear Knitting Mills"
"258","315220","Men’s and Boys’ Cut and Sew Apparel Manufacturing"
"259","315223","Men's And Boys' Cut And Sew Shirt (Except Work Sh"
"260","315224","Men's And Boys' Cut And Sew Trouser, Slack, And J"
"261","315228","Men's And Boys' Cut And Sew Other Outerwear Manuf"
"262","315231","Women's And Girls' Cut And Sew Lingerie, Loungewe"
"263","315232","Women's And Girls' Cut And Sew Blouse And Shirt M"
"264","315233","Women's And Girls' Cut And Sew Dress Manufacturin"
"265","315239","Women's And Girls' Cut And Sew Other Outerwear Ma"
"266","315240","Women’s, Girls’, and Infants’ Cut and Sew Apparel Manufacturing"
"267","315280","Other Cut and Sew Apparel Manufacturing"
"268","315291","Infants' Cut And Sew Apparel Manufacturing"
"269","315299","All Other Cut And Sew Apparel Manufacturing"
"270","315990","Apparel Accessories and Other Apparel Manufacturing"
"271","315999","Other Apparel Accessories And Other Apparel Manuf"
"272","316110","Leather and Hide Tanning and Finishing"
"273","316210","Footwear Manufacturing"
"274","316211","Rubber And Plastics Footwear Manufacturing"
"275","316213","Men's Footwear (Except Athletic) Manufacturing"
"276","316219","Other Footwear Manufacturing"
"277","316991","Luggage Manufacturing"
"278","316992","Women's Handbag and Purse Manufacturing"
"279","316998","All Other Leather Good and Allied Product Manufacturing"
"280","321113","Sawmills"
"281","321114","Wood Preservation"
"282","321211","Hardwood Veneer and Plywood Manufacturing"
"283","321212","Softwood Veneer and Plywood Manufacturing"
"284","321213","Engineered Wood Member (except Truss) Manufacturing"
"285","321219","Reconstituted Wood Product Manufacturing"
"286","321911","Wood Window and Door Manufacturing"
"287","321912","Cut Stock, Resawing Lumber, and Planing"
"288","321918","Other Millwork (including Flooring)"
"289","321920","Wood Container and Pallet Manufacturing"
"290","321991","Manufactured Home (Mobile Home) Manufacturing"
"291","321992","Prefabricated Wood Building Manufacturing"
"292","321999","All Other Miscellaneous Wood Product Manufacturing"
"293","322110","Pulp Mills"
"294","322121","Paper (except Newsprint) Mills"
"295","322122","Newsprint Mills"
"296","322130","Paperboard Mills"
"297","322211","Corrugated and Solid Fiber Box Manufacturing"
"298","322212","Folding Paperboard Box Manufacturing"
"299","322214","Fiber Can, Tube, Drum, And Similar Products Manuf"
"300","322215","Nonfolding Sanitary Food Container Manufacturing"
"301","322219","Other Paperboard Container Manufacturing"
"302","322220","Paper Bag and Coated and Treated Paper Manufacturing"
"303","322221","Coated And Laminated Packaging Paper And Plastics"
"304","322222","Coated And Laminated Paper Manufacturing"
"305","322223","Plastics, Foil, And Coated Paper Bag Manufacturin"
"306","322226","Surface-Coated Paperboard Manufacturing"
"307","322230","Stationery Product Manufacturing"
"308","322233","Stationery, Tablet, And Related Product Manufactu"
"309","322291","Sanitary Paper Product Manufacturing"
"310","322299","All Other Converted Paper Product Manufacturing"
"311","323110","Commercial Lithographic Printing"
"312","323111","Commercial Printing (except Screen and Books)"
"313","323112","Commercial Flexographic Printing"
"314","323113","Commercial Screen Printing"
"315","323114","Quick Printing"
"316","323115","Digital Printing"
"317","323118","Blankbook, Looseleaf Binders, And Devices Manufac"
"318","323119","Other Commercial Printing"
"319","323120","Support Activities for Printing"
"320","323122","Prepress Services"
"321","324110","Petroleum Refineries"
"322","324121","Asphalt Paving Mixture and Block Manufacturing"
"323","324122","Asphalt Shingle and Coating Materials Manufacturing"
"324","324191","Petroleum Lubricating Oil and Grease Manufacturing"
"325","324199","All Other Petroleum and Coal Products Manufacturing"
"326","325110","Petrochemical Manufacturing"
"327","325120","Industrial Gas Manufacturing"
"328","325130","Synthetic Dye and Pigment Manufacturing"
"329","325131","Inorganic Dye And Pigment Manufacturing"
"330","325132","Synthetic Organic Dye And Pigment Manufacturing"
"331","325180","Other Basic Inorganic Chemical Manufacturing"
"332","325188","All Other Basic Inorganic Chemical Manufacturing"
"333","325191","Gum And Wood Chemical Manufacturing"
"334","325194","Cyclic Crude, Intermediate, and Gum and Wood Chemical Manufacturing"
"335","325199","All Other Basic Organic Chemical Manufacturing"
"336","325211","Plastics Material and Resin Manufacturing"
"337","325212","Synthetic Rubber Manufacturing"
"338","325222","Noncellulosic Organic Fiber Manufacturing"
"339","325311","Nitrogenous Fertilizer Manufacturing"
"340","325312","Phosphatic Fertilizer Manufacturing"
"341","325314","Fertilizer (Mixing Only) Manufacturing"
"342","325320","Pesticide and Other Agricultural Chemical Manufacturing"
"343","325411","Medicinal and Botanical Manufacturing"
"344","325412","Pharmaceutical Preparation Manufacturing"
"345","325413","In-Vitro Diagnostic Substance Manufacturing"
"346","325414","Biological Product (except Diagnostic) Manufacturing"
"347","325510","Paint and Coating Manufacturing"
"348","325520","Adhesive Manufacturing"
"349","325611","Soap and Other Detergent Manufacturing"
"350","325612","Polish and Other Sanitation Good Manufacturing"
"351","325613","Surface Active Agent Manufacturing"
"352","325620","Toilet Preparation Manufacturing"
"353","325910","Printing Ink Manufacturing"
"354","325920","Explosives Manufacturing"
"355","325991","Custom Compounding of Purchased Resins"
"356","325992","Photographic Film, Paper, Plate, Chemical, and Copy Toner Manufacturing"
"357","325992","Photographic Film, Paper, Plate, and Chemical Manufacturing"
"358","325998","All Other Miscellaneous Chemical Product and Preparation Manufacturing"
"359","326111","Plastics Bag and Pouch Manufacturing"
"360","326112","Plastics Packaging Film and Sheet (including Laminated) Manufacturing"
"361","326113","Unlaminated Plastics Film and Sheet (except Packaging) Manufacturing"
"362","326121","Unlaminated Plastics Profile Shape Manufacturing"
"363","326122","Plastics Pipe and Pipe Fitting Manufacturing"
"364","326130","Laminated Plastics Plate, Sheet (except Packaging), and Shape Manufacturing"
"365","326140","Polystyrene Foam Product Manufacturing"
"366","326150","Urethane and Other Foam Product (except Polystyrene) Manufacturing"
"367","326160","Plastics Bottle Manufacturing"
"368","326191","Plastics Plumbing Fixture Manufacturing"
"369","326192","Resilient Floor Covering Manufacturing"
"370","326199","All Other Plastics Product Manufacturing"
"371","326211","Tire Manufacturing (except Retreading)"
"372","326212","Tire Retreading"
"373","326220","Rubber and Plastics Hoses and Belting Manufacturing"
"374","326291","Rubber Product Manufacturing for Mechanical Use"
"375","326299","All Other Rubber Product Manufacturing"
"376","3271","Concrete Block and Brick"
"377","327120","Clay Building Material and Refractories Manufacturing"
"378","327122","Ceramic Wall And Floor Tile Manufacturing"
"379","327124","Clay Refractory Manufacturing"
"380","327125","Nonclay Refractory Manufacturing"
"381","3272","Concrete Products - Except Block and Brick"
"382","327210","Glass And Glass Product Manufacturing"
"383","327211","Flat Glass Manufacturing"
"384","327215","Glass Product Manufacturing Made of Purchased Glass"
"385","327310","Cement Manufacturing"
"386","327320","Ready-Mix Concrete Manufacturing"
"387","327331","Concrete Block and Brick Manufacturing"
"388","327390","Other Concrete Product Manufacturing"
"389","327410","Lime Manufacturing"
"390","327910","Abrasive Product Manufacturing"
"391","327991","Cut Stone and Stone Product Manufacturing"
"392","327992","Ground or Treated Mineral and Earth Manufacturing"
"393","327993","Mineral Wool Manufacturing"
"394","327999","All Other Miscellaneous Nonmetallic Mineral Product Manufacturing"
"395","3291","Abrasive Products"
"396","331110","Iron and Steel Mills and Ferroalloy Manufacturing"
"397","331111","Iron And Steel Mills"
"398","3312","Steel Works - Blast Furnaces - and Rolling Mills"
"399","331210","Iron and Steel Pipe and Tube Manufacturing from Purchased Steel"
"400","331221","Rolled Steel Shape Manufacturing"
"401","331222","Steel Wire Drawing"
"402","331312","Primary Aluminum Production"
"403","331313","Alumina Refining and Primary Aluminum Production"
"404","331314","Secondary Smelting and Alloying of Aluminum"
"405","331315","Aluminum Sheet, Plate, and Foil Manufacturing"
"406","331316","Aluminum Extruded Product Manufacturing"
"407","331318","Other Aluminum Rolling, Drawing, and Extruding"
"408","331319","Other Aluminum Rolling And Drawing"
"409","331410","Nonferrous Metal (except Aluminum) Smelting and Refining"
"410","331411","Primary Smelting And Refining Of Copper"
"411","331419","Primary Smelting And Refining Of Nonferrous Metal"
"412","331420","Copper Rolling, Drawing, Extruding, and Alloying"
"413","331421","Copper Rolling, Drawing, And Extruding"
"414","331422","Copper Wire (Except Mechanical) Drawing"
"415","331423","Secondary Smelting, Refining, And Alloying Of Cop"
"416","331491","Nonferrous Metal (except Copper and Aluminum) Rolling, Drawing, and Extrudi"
"417","331492","Secondary Smelting, Refining, and Alloying of Nonferrous Metal (except Copp"
"418","331511","Iron Foundries"
"419","331513","Steel Foundries (except Investment)"
"420","331521","Aluminum Die-Casting Foundries"
"421","331522","Nonferrous (Except Aluminum) Die-Casting Foundrie"
"422","331523","Nonferrous Metal Die-Casting Foundries"
"423","331524","Aluminum Foundries (except Die-Casting)"
"424","331525","Copper Foundries (Except Die-Casting)"
"425","331529","Other Nonferrous Metal Foundries (except Die-Casting)"
"426","332111","Iron and Steel Forging"
"427","332112","Nonferrous Forging"
"428","332114","Custom Roll Forming"
"429","332116","Metal Stamping"
"430","332117","Powder Metallurgy Part Manufacturing"
"431","332119","Metal Crown, Closure, and Other Metal Stamping (except Automotive)"
"432","332211","Cutlery And Flatware (Except Precious) Manufactur"
"433","332212","Hand And Edge Tool Manufacturing"
"434","332213","Saw Blade And Handsaw Manufacturing"
"435","332214","Kitchen Utensil, Pot, And Pan Manufacturing"
"436","332215","Metal Kitchen Cookware, Utensil, Cutlery, and Flatware (except Precious) Ma"
"437","332216","Saw Blade and Handtool Manufacturing"
"438","332311","Prefabricated Metal Building and Component Manufacturing"
"439","332312","Fabricated Structural Metal Manufacturing"
"440","332313","Plate Work Manufacturing"
"441","332321","Metal Window and Door Manufacturing"
"442","332322","Sheet Metal Work Manufacturing"
"443","332323","Ornamental and Architectural Metal Work Manufacturing"
"444","332410","Power Boiler and Heat Exchanger Manufacturing"
"445","332420","Metal Tank (Heavy Gauge) Manufacturing"
"446","332431","Metal Can Manufacturing"
"447","332439","Other Metal Container Manufacturing"
"448","332510","Hardware Manufacturing"
"449","332610","Spring And Wire Product Manufacturing"
"450","332611","Spring (Heavy Gauge) Manufacturing"
"451","332612","Spring (Light Gauge) Manufacturing"
"452","332613","Spring Manufacturing"
"453","332618","Other Fabricated Wire Product Manufacturing"
"454","332710","Machine Shops"
"455","332721","Precision Turned Product Manufacturing"
"456","332722","Bolt, Nut, Screw, Rivet, and Washer Manufacturing"
"457","332812","Metal Coating, Engraving (except Jewelry and Silverware), and Allied Servic"
"458","332813","Electroplating, Plating, Polishing, Anodizing, and Coloring"
"459","332911","Industrial Valve Manufacturing"
"460","332912","Fluid Power Valve and Hose Fitting Manufacturing"
"461","332913","Plumbing Fixture Fitting and Trim Manufacturing"
"462","332919","Other Metal Valve and Pipe Fitting Manufacturing"
"463","332990","All Other Fabricated Metal Product Manufacturing"
"464","332991","Ball and Roller Bearing Manufacturing"
"465","332992","Small Arms Ammunition Manufacturing"
"466","332993","Ammunition (except Small Arms) Manufacturing"
"467","332994","Small Arms, Ordnance, and Ordnance Accessories Manufacturing"
"468","332996","Fabricated Pipe and Pipe Fitting Manufacturing"
"469","332997","Industrial Pattern Manufacturing"
"470","332999","All Other Miscellaneous Fabricated Metal Product Manufacturing"
"471","333111","Farm Machinery and Equipment Manufacturing"
"472","333112","Lawn and Garden Tractor and Home Lawn and Garden Equipment Manufacturing"
"473","333120","Construction Machinery Manufacturing"
"474","333131","Mining Machinery and Equipment Manufacturing"
"475","333132","Oil and Gas Field Machinery and Equipment Manufacturing"
"476","333210","Sawmill And Woodworking Machinery Manufacturing"
"477","333220","Plastics And Rubber Industry Machinery Manufactur"
"478","333241","Food Product Machinery Manufacturing"
"479","333242","Semiconductor Machinery Manufacturing"
"480","333243","Sawmill, Woodworking, and Paper Machinery Manufacturing"
"481","333244","Printing Machinery and Equipment Manufacturing"
"482","333248","All Other Industrial Machinery Manufacturing"
"483","333249","Other Industrial Machinery Manufacturing"
"484","333290","Other Industrial Machinery Manufacturing"
"485","333291","Paper Industry Machinery Manufacturing"
"486","333292","Textile Machinery Manufacturing"
"487","333293","Printing Machinery And Equipment Manufacturing"
