"CompetitionClassification","Vehicle.sum7","2010","2011","2012","2013","2014","2015","2016","2018","2020","2021","2023","2008","2009","2006","2007","2024","2025","2019"
"Unlabeled: Blank Extent Competed","BOA or BPA",0,0,0,0,0,0,0,0,0,0,0,,,,,,,
"Unlabeled: Blank Fair Opportunity","FSS or GWAC",-633707.346711486,-260226.759997001,,,,,,,,,,10750648.4446888,0,,,,,
"Unlabeled: Blank Fair Opportunity","Multi-Awd.",269208.724143077,,,-25506.8759798883,-1538.21347558871,,,,,,,254841.415202767,246484.871746559,623074.717081572,681371.928420349,,,
"Unlabeled: Competition; Unlabeled Offers","Single-Awd.",,,,,,,,,,,,,,,,45047537.3578906,12460612.7868634,
"Unlabeled: Competition; Zero Offers","Pur. Order",,,,,,,,,,,,21429.1728125973,,,,,,
"Unlabeled: No competition; multiple offers","Multi-Awd.",31255588.0728305,17000600.8020394,4262690.60709868,3167431.02529137,-40042.9548350671,0,,-338428.361337288,-8267.07969713381,,,869874.377445427,1463268.54829519,145477.297045787,,,,0
