ProductOrServiceCode,ProductOrServiceCodeText,ProductServiceOrRnDarea, Action_Obligation_OMB25_GDP23 ,SpaceArea
1325,BOMBS,Launchers & Munitions,"4,370,550",Other Products
1377,CARTRIDGE & PROPELLANT DEVICES,Launchers & Munitions,"8,631,361",Other Products
1555,Space Vehicles,Missiles & Space,"287,276,136",Space Vehicles and Components
1560,AIRFRAME STRUCTURAL COMPONENTS,Aircraft,"106,421",Other Products
1675,Space Vehicle Component,Missiles & Space,"7,672,990",Space Vehicles and Components
1680,MISCELLANEOUS AIRCRAFT ACCESSORIES AND COMPONENTS,Aircraft,"35,529,910",Other Products
1810,SPACE VEHICLES,Missiles & Space,"15,261,421,217",Space Vehicles and Components
1820,SPACE VEHICLE COMPONENTS,Missiles & Space,"3,773,699,874",Space Vehicles and Components
1840,SPACE VEHICLE LAUNCHERS,Missiles & Space,"1,761,757,277",Space Vehicle Launchers
5810,COMM SECURITY EQ & COMPS,Electronics & Communications,"118,274",Other Products
5825,RADIO NAVIGATION EQ - EXCEPT AIR,Electronics & Communications,"503,757,414",Other Products
5826,RADIO NAVIGATION EQ AIR,Electronics & Communications,"583,489",Other Products
5841,"RADAR EQUIPMENT, AIRBORNE",Electronics & Communications,"194,926,886",Other Products
5895,MISC COMMUNICATION EQ,Electronics & Communications,"265,237",Other Products
5985,ANTENNAS WAVEGUIDES & RELATED EQ,Electronics & Communications,"135,000",Other Products
5999,MISCELLANEOUS ELECTRICAL AND ELECTRONIC COMPONENTS,Electronics & Communications,"91,974",Other Products
6150,MISC ELECTRIC POWER & DISTRIB EQ,Electronics & Communications,"773,932",Other Products
6350,"MISC ALARM, SIGNAL, SEC SYSTEMS",Electronics & Communications,"149,652",Other Products
6650,OPTICAL INSTRUMENTS,Other,"2,860,286",Other Products
7021,"ADP CENTRAL PROCESSING UNIT (CPU, COMPUTER), DIGITAL",Electronics & Communications,"738,246",Other Products
7030,ADP SOFTWARE,Electronics & Communications,"734,609",Other Products
7A20,IT AND TELECOM - APPLICATION DEVELOPMENT SOFTWARE (PERPETUAL LICENSE SOFTWARE),Electronics & Communications, -   ,Other Products
7E21,IT AND TELECOM - MOBILE DEVICE PRODUCTS (HARDWARE AND PERPETUAL LICENSE SOFTWARE),Electronics & Communications,"2,720",Other Products
7G20,IT AND TELECOM - NETWORK: ANALOG VOICE PRODUCTS (HARDWARE AND PERPETUAL LICENSE SOFTWARE),Electronics & Communications,"588,795",Other Products
7G22,"IT AND TELECOM - NETWORK: SATELLITE AND RF COMMUNICATIONS PRODUCTS (HW, PERPETUAL LICENSE SOFTWARE)",Electronics & Communications,"2,003,157",Other Products
AC13,DEFENSE AIRCRAFT (ADVANCED),Experimental Development,"26,904,693",Other Products
AC21,R&D- DEFENSE SYSTEM: MISSILE/SPACE SYSTEMS (BASIC RESEARCH),Basic Research (6.1),"196,512,709",R&D (Defense)
AC22,R&D- DEFENSE SYSTEM: MISSILE/SPACE SYSTEMS (APPLIED RESEARCH/EXPLORATORY DEVELOPMENT),Applied Research (6.2),"3,541,548,119",R&D (Defense)
AC23,R&D- DEFENSE SYSTEM: MISSILE/SPACE SYSTEMS (ADVANCED DEVELOPMENT),Advanced Development,"1,638,318,294",R&D (Defense)
AC23,R&D- DEFENSE SYSTEM: MISSILE/SPACE SYSTEMS (ADVANCED DEVELOPMENT),Experimental Development,"162,513,413",R&D (Defense)
AC24,R&D- DEFENSE SYSTEM: MISSILE/SPACE SYSTEMS (ENGINEERING DEVELOPMENT),Engineering Development,"4,034,412,036",R&D (Defense)
AC24,R&D- DEFENSE SYSTEM: MISSILE/SPACE SYSTEMS (ENGINEERING DEVELOPMENT),R&D administrative and operational expenses,"2,830,625",R&D (Defense)
AC25,R&D- DEFENSE SYSTEM: MISSILE/SPACE SYSTEMS (OPERATIONAL SYSTEMS DEVELOPMENT),Operational Systems Development,"3,653,902,336",R&D (Defense)
AC25,R&D- DEFENSE SYSTEM: MISSILE/SPACE SYSTEMS (OPERATIONAL SYSTEMS DEVELOPMENT),R&D facilities and major equipment,"139,583,897",R&D (Defense)
AC26,R&D- DEFENSE SYSTEM: MISSILE/SPACE SYSTEMS (MANAGEMENT/SUPPORT),R&D administrative and operational expenses,"2,236,623,119",R&D (Defense)
AC27,R&D- DEFENSE SYSTEM: MISSILE/SPACE SYSTEMS (COMMERCIALIZED),Commercialization,"308,455,864",R&D (Defense)
AC32,DEFENSE SHIPS (APPLIED/EXPLORATORY),Applied Research (6.2),"896,148",R&D (Defense)
AC61,R&D- DEFENSE SYSTEM: ELECTRONICS/COMMUNICATION EQUIPMENT (BASIC RESEARCH),Basic Research (6.1),"1,039,944",R&D (Defense)
AC62,R&D- DEFENSE SYSTEM: ELECTRONICS/COMMUNICATION EQUIPMENT (APPLIED RESEARCH/EXPLORATORY DEVELOPMENT),Applied Research (6.2),"7,210,771",R&D (Defense)
AC65,R&D- DEFENSE SYSTEM: ELECTRONICS/COMMUNICATION EQUIPMENT (OPERATIONAL SYSTEMS DEVELOPMENT),Operational Systems Development,"82,248,985",R&D (Defense)
AD22,R&D- DEFENSE OTHER: SERVICES (APPLIED RESEARCH/EXPLORATORY DEVELOPMENT),Applied Research (6.2),"4,837,414",R&D (Defense)
AD92,OTHER DEFENSE (APPLIED/EXPLORATORY),Applied Research (6.2),"3,246,655",R&D (Defense)
AD93,OTHER DEFENSE (ADVANCED),Advanced Development,"548,688",R&D (Defense)
AD95,OTHER DEFENSE (OPERATIONAL),Operational Systems Development,"252,824,549",R&D (Defense)
AJ11,PHYSICAL SCIENCES (BASIC),Basic Research (6.1),"628,003",R&D (All Other)
AJ14,PHYSICAL SCIENCES (ENGINEERING),R&D administrative and operational expenses,"2,738,141",R&D (All Other)
AJ41,ENGINEERING (BASIC),Basic Research (6.1),"125,078",R&D (All Other)
AJ45,ENGINEERING (OPERATIONAL),Operational Systems Development,"2,277,813",R&D (All Other)
AJ47,R&D- GENERAL SCIENCE/TECHNOLOGY: ENGINEERING (COMMERCIALIZED),Commercialization,"1,679,272,023",R&D (All Other)
AJ71,R&D- GENERAL SCIENCE/TECHNOLOGY: SOCIAL SCIENCES (BASIC RESEARCH),Basic Research (6.1),"71,630",R&D (All Other)
AR11,R&D- SPACE: AERONAUTICS/SPACE TECHNOLOGY (BASIC RESEARCH),Basic Research (6.1),"15,843,708,829",R&D (Space Flight)
AR12,R&D- SPACE: AERONAUTICS/SPACE TECHNOLOGY (APPLIED RESEARCH/EXPLORATORY DEVELOPMENT),Applied Research (6.2),"754,029,280",R&D (Space Flight)
AR13,R&D- SPACE: AERONAUTICS/SPACE TECHNOLOGY (ADVANCED DEVELOPMENT),Advanced Development,"207,042,423",R&D (Space Flight)
AR13,R&D- SPACE: AERONAUTICS/SPACE TECHNOLOGY (ADVANCED DEVELOPMENT),Experimental Development,"116,290,754",R&D (Space Flight)
AR14,R&D- SPACE: AERONAUTICS/SPACE TECHNOLOGY (ENGINEERING DEVELOPMENT),Engineering Development,"947,190,827",R&D (Space Flight)
AR14,R&D- SPACE: AERONAUTICS/SPACE TECHNOLOGY (ENGINEERING DEVELOPMENT),R&D administrative and operational expenses,"190,509,704",R&D (Space Flight)
AR15,R&D- SPACE: AERONAUTICS/SPACE TECHNOLOGY (OPERATIONAL SYSTEMS DEVELOPMENT),Operational Systems Development,"58,884",R&D (Space Flight)
AR15,R&D- SPACE: AERONAUTICS/SPACE TECHNOLOGY (OPERATIONAL SYSTEMS DEVELOPMENT),R&D facilities and major equipment,"13,778,153",R&D (Space Flight)
AR16,R&D- SPACE: AERONAUTICS/SPACE TECHNOLOGY (MANAGEMENT/SUPPORT),R&D administrative and operational expenses,"3,200,053",R&D (Space Flight)
AR17,R&D-AERO & SPACE TECH-COMERCLIZ,Commercialization,"28,366,239",R&D (Space Flight)
AR21,R&D- SPACE: SCIENCE/APPLICATIONS (BASIC RESEARCH),Basic Research (6.1),"1,539,362,573",R&D (All Other)
AR22,R&D- SPACE: SCIENCE/APPLICATIONS (APPLIED RESEARCH/EXPLORATORY DEVELOPMENT),Applied Research (6.2),"3,761,327,491",R&D (All Other)
AR23,R&D- SPACE: SCIENCE/APPLICATIONS (ADVANCED DEVELOPMENT),Advanced Development,"1,245,123,118",R&D (All Other)
AR24,R&D- SPACE: SCIENCE/APPLICATIONS (ENGINEERING DEVELOPMENT),Engineering Development,"2,037,426,017",R&D (All Other)
AR25,R&D- SPACE: SCIENCE/APPLICATIONS (OPERATIONAL SYSTEMS DEVELOPMENT),Operational Systems Development, -   ,R&D (All Other)
AR31,R&D- SPACE: FLIGHT (BASIC RESEARCH),Basic Research (6.1),"154,352,869",R&D (Space Flight)
AR32,R&D- SPACE: FLIGHT (APPLIED RESEARCH/EXPLORATORY DEVELOPMENT),Applied Research (6.2),"2,832,909,775",R&D (Space Flight)
AR33,R&D- SPACE: FLIGHT (ADVANCED DEVELOPMENT),Advanced Development,"1,601,683,802",R&D (Space Flight)
AR34,R&D- SPACE: FLIGHT (ENGINEERING DEVELOPMENT),Engineering Development,"6,558,832,502",R&D (Space Flight)
AR35,R&D- SPACE: FLIGHT (OPERATIONAL SYSTEMS DEVELOPMENT),Operational Systems Development,"451,713,430",R&D (Space Flight)
AR37,R&D- SPACE: FLIGHT (COMMERCIALIZED),Commercialization,"57,870",R&D (Space Flight)
AR41,"R&D- SPACE: OPERATIONS, TRACKING AND DATA ACQUISITION (BASIC RESEARCH)",Basic Research (6.1),"297,141",R&D (All Other)
AR42,"R&D- SPACE: OPERATIONS, TRACKING AND DATA ACQUISITION (APPLIED RESEARCH/EXPLORATORY DEVELOPMENT)",Applied Research (6.2),"19,568,124",R&D (All Other)
AR44,"R&D- SPACE: OPERATIONS, TRACKING AND DATA ACQUISITION (ENGINEERING DEVELOPMENT)",Engineering Development,"1,532,043,614",R&D (All Other)
AR45,"R&D- SPACE: OPERATIONS, TRACKING AND DATA ACQUISITION (OPERATIONAL SYSTEMS DEVELOPMENT)",Operational Systems Development,"9,060,574",R&D (All Other)
AR46,"R&D- SPACE: OPERATIONS, TRACKING AND DATA ACQUISITION (MANAGEMENT/SUPPORT)",R&D administrative and operational expenses,"407,600",R&D (All Other)
AR55,RDTE/SP+TERRESTRIAL APP-ENG/MANUF,Operational Systems Development,"6,300,235,976",R&D (All Other)
AR61,R&D-SPACE STATION-B RES,Basic Research (6.1),"153,825",R&D (Space Station)
AR62,R&D- SPACE: STATION (APPLIED RESEARCH/EXPLORATORY DEVELOPMENT),Applied Research (6.2),"13,568,301,336",R&D (Space Station)
AR64,R&D- SPACE: STATION (ENGINEERING DEVELOPMENT),Engineering Development,"7,071,893",R&D (Space Station)
AR67,R&D- SPACE: STATION (COMMERCIALIZED),Commercialization,"305,175",R&D (Space Station)
AR71,R&D- SPACE: COMMERCIAL PROGRAMS (BASIC RESEARCH),Basic Research (6.1),"43,773,543",R&D (All Other)
AR72,R&D- SPACE: COMMERCIAL PROGRAMS (APPLIED RESEARCH/EXPLORATORY DEVELOPMENT),Applied Research (6.2),"797,921",R&D (All Other)
AR73,R&D- SPACE: COMMERCIAL PROGRAMS (ADVANCED DEVELOPMENT),Advanced Development,"92,465",R&D (All Other)
AR91,R&D- SPACE: OTHER (BASIC RESEARCH),Basic Research (6.1),"1,833,511",R&D (All Other)
AR92,R&D- SPACE: OTHER (APPLIED RESEARCH/EXPLORATORY DEVELOPMENT),Applied Research (6.2),"498,192,068",R&D (All Other)
AR94,R&D- SPACE: OTHER (ENGINEERING DEVELOPMENT),Engineering Development,"11,614,691",R&D (All Other)
AR95,R&D- SPACE: OTHER (OPERATIONAL SYSTEMS DEVELOPMENT),Operational Systems Development,"28,296,564",R&D (All Other)
AS91,OTHER MODAL TRANSPORTATION (BASIC),Basic Research (6.1),"1,309,280",R&D (All Other)
AZ12,R&D- OTHER RESEARCH AND DEVELOPMENT (APPLIED RESEARCH/EXPLORATORY DEVELOPMENT),Applied Research (6.2),"9,518,979",R&D (All Other)
B539,AERONAUTIC/SPACE STUDIES,PAMS,"1,164,016",Other Services
C211,A/E SVCS. (INCL LANDSCAPING INTERIO,PAMS,"26,207,125",Other Services
D306,ADP SYSTEMS ANALYSIS SERVICES,ICT,"1,430,372",Other Services
D307,AUTOMATED INFORMATION SYSTEM SVCS,ICT,"8,512,494",Other Services
D399,IT AND TELECOM- OTHER IT AND TELECOMMUNICATIONS,ICT,"-14,548",Other Services
DD01,"IT AND TELECOM - SERVICE DELIVERY SUPPORT SERVICES: ITSM, OPERATIONS CENTER, PROJECT/PM (LABOR)",ICT,"2,291,540",Other Services
DG01,IT AND TELECOM - NETWORK SUPPORT SERVICES (LABOR),ICT,"480,156",Other Services
DG10,IT AND TELECOM - NETWORK AS A SERVICE,ICT,"18,134,393",Other Services
DG11,IT AND TELECOM - NETWORK - TELECOM ACCESS SERVICES,ICT,"658,181",Other Services
H118,QUALITY CONT SV/SPACE VEHICLES,PAMS,"977,174,291",Space Vehicle Services
H218,EQ TEST SVCS/SPACE VEHICLES,PAMS,"78,921,562",Other Services
H249,EQ TEST SVCS/MAINT REPAIR SHOP EQ,PAMS,"97,090",Other Services
J018,MAINT-REP OF SPACE VEHICLES,ERS,"3,490,337,106",Space Vehicle Services
J059,MAINT-REP OF ELECT-ELCT EQ,ERS,"79,854",Other Services
J066,MAINT-REP OF INSTRUMENTS & LAB EQ,ERS,"681,756",Other Services
L016,TECH REP SVCS/AIRCRAFT COMPONENTS,PAMS,"750,433",Other Services
N063,INSTALL OF ALARM & SIGNAL SYSTEM,ERS,"343,076",Other Services
R407,PROGRAM EVALUATION SERVICES,PAMS,"63,711",Other Services
R410,SUPPORT- PROFESSIONAL: PROGRAM EVALUATION/REVIEW/DEVELOPMENT,PAMS,"174,512",Other Services
R414,SYSTEMS ENGINEERING SERVICES,PAMS,"8,636,602",Other Services
R425,ENGINEERING AND TECHNICAL SERVICES,PAMS,"174,782,426",Other Services
R426,COMMUNICATIONS SERVICES,PAMS,"899,616",Other Services
R499,OTHER PROFESSIONAL SERVICES,PAMS,"5,812",Other Services
R699,OTHER ADMINISTRATIVE SUPPORT SVCS,PAMS,"14,118",Other Services
R701,ADVERTISING SERVICES,PAMS,"91,974",Other Services
R707,MGT SVCS/CONTRACT & PROCUREMENT SUP,PAMS,"29,095",Other Services
U099,EDUCATION/TRAINING- OTHER,PAMS,"33,455",Other Services
V126,SPACE TRANSP & LAUNCH,ERS,"41,675,972,517",Space Transp. and Launch
